itemId,title,genres,imdb_id,imdb_rating,imdb_votes,metascore,runtime,MPAA_rating,imdb_genres,director,actors,year
3422,She's Gotta Have It,"Comedy, Romance",tt0091939,6.6,6829,79,84,R,"Comedy, Romance",Spike Lee,"Tracy Camilla Johns, Tommy Redmond Hicks, John Canada Terrell, Spike Lee",1986
3423,School Daze,Drama,tt0096054,5.9,5460,49,121,R,"Comedy, Drama, Musical",Spike Lee,"Laurence Fishburne, Giancarlo Esposito, Tisha CampbellMartin, Kyme",1988
3424,Do the Right Thing,"Comedy, Drama",tt0097216,7.9,72332,91,120,R,"Comedy, Drama",Spike Lee,"Danny Aiello, Ossie Davis, Ruby Dee, Richard Edson",1989
3425,Mo' Better Blues,Drama,tt0100168,6.6,9673,61,130,R,"Drama, Music, Romance",Spike Lee,"Denzel Washington, Spike Lee, Wesley Snipes, Giancarlo Esposito",1990
3426,Jungle Fever,"Drama, Romance",tt0102175,6.5,15164,0,132,R,"Drama, Romance",Spike Lee,"Wesley Snipes, Annabella Sciorra, Spike Lee, Ossie Davis",1991
3427,Coogan's Bluff,Crime,tt0062824,6.5,13838,0,93,R,"Action, Comedy, Crime, Thriller",Don Siegel,"Clint Eastwood, Lee J Cobb, Susan Clark, Tisha Sterling",1968
3428,"Champ, The",Drama,tt0078950,6.8,6741,0,121,PG,"Drama, Sport",Franco Zeffirelli,"Jon Voight, Faye Dunaway, Ricky Schroder, Jack Warden",1979
3429,Creature Comforts,"Animation, Comedy",tt0099317,7.7,5528,0,5,,"Animation, Comedy, Short",Nick Park,Julie Sedgewick,1990
3430,Death Wish,"Action, Drama",tt0071402,7.0,31027,51,93,R,"Action, Crime, Drama, Thriller",Michael Winner,"Charles Bronson, Hope Lange, Vincent Gardenia, Steven Keats",1974
3431,Death Wish II,"Action, Drama",tt0082250,6.0,12826,11,89,R,"Action, Crime, Drama, Thriller",Michael Winner,"Charles Bronson, Jill Ireland, Vincent Gardenia, JD Cannon",1982
3432,Death Wish 3,"Action, Drama",tt0089003,5.9,12419,18,92,R,"Action, Crime, Drama, Thriller",Michael Winner,"Charles Bronson, Deborah Raffin, Ed Lauter, Martin Balsam",1985
3433,Death Wish 4: The Crackdown,"Action, Drama",tt0092857,5.4,7645,46,99,R,"Action, Crime, Drama, Thriller",J Lee Thompson,"Charles Bronson, Kay Lenz, John P Ryan, Perry Lopez",1987
3434,Death Wish V: The Face of Death,"Action, Drama",tt0109578,4.8,6069,25,95,R,"Action, Crime, Drama, Thriller",Allan A Goldstein,"Charles Bronson, LesleyAnne Down, Michael Parks, Chuck Shamata",1994
3435,Double Indemnity,"Crime, Film-Noir",tt0036775,8.3,124717,95,107,Passed,"Crime, Drama, Film-Noir, Mystery, Thriller",Billy Wilder,"Fred MacMurray, Barbara Stanwyck, Edward G Robinson, Porter Hall",1944
3436,Dying Young,"Drama, Romance",tt0101787,6.0,13585,0,111,R,"Drama, Romance",Joel Schumacher,"Julia Roberts, Campbell Scott, Vincent D'Onofrio, Colleen Dewhurst",1991
3437,Cool as Ice,Drama,tt0101615,2.9,8301,0,91,PG,"Comedy, Music, Romance",David Kellogg,"Naomi Campbell, Vanilla Ice, Deezer D, Kevin Hicks",1991
3438,Teenage Mutant Ninja Turtles,"Action, Children's, Fantasy",tt0100758,6.8,77350,51,93,PG,"Action, Adventure, Comedy, Family, Sci-Fi",Steve Barron,"Judith Hoag, Elias Koteas, Josh Pais, David Forman",1990
3439,Teenage Mutant Ninja Turtles II: The Secret of the Ooze,"Action, Children's, Fantasy",tt0103060,6.0,47243,45,88,PG,"Action, Adventure, Comedy, Family, Sci-Fi",Michael Pressman,"Paige Turco, David Warner, Michelan Sisti, Leif Tilden",1991
3440,Teenage Mutant Ninja Turtles III,"Action, Children's, Fantasy",tt0108308,4.8,28293,40,96,PG,"Action, Adventure, Comedy, Family, Fantasy, Sci-Fi",Stuart Gillard,"Elias Koteas, Paige Turco, Stuart Wilson, Sab Shimono",1993
3441,Red Dawn,"Action, War",tt0087985,6.4,46530,55,114,PG-13,"Action, Drama",John Milius,"Patrick Swayze, C Thomas Howell, Lea Thompson, Charlie Sheen",1984
3442,Band of the Hand,Action,tt0090693,6.3,2473,0,109,R,"Action, Crime, Drama",Paul Michael Glaser,"Stephen Lang, Michael Carmine, Lauren Holly, John Cameron Mitchell",1986
3443,Born American,"Action, Drama, Thriller",tt0091313,4.3,1511,35,95,R,"Action, Drama, Thriller",Renny Harlin,"Mike Norris, Steve Durham, David Coburn, Thalmus Rasulala",1986
3444,Bloodsport,Action,tt0092675,6.8,68162,29,92,R,"Action, Biography, Drama, Sport",Newt Arnold,"JeanClaude Van Damme, Donald Gibb, Leah Ayres, Norman Burton",1988
3445,Eyes of Laura Mars,"Mystery, Thriller",tt0077530,6.1,7161,0,104,R,"Mystery, Thriller",Irvin Kershner,"Faye Dunaway, Tommy Lee Jones, Brad Dourif, Rene Auberjonois",1978
3446,Funny Bones,Comedy,tt0113133,7.0,3336,0,128,R,"Comedy, Drama",Peter Chelsom,"Oliver Platt, Jerry Lewis, Lee Evans, Leslie Caron",1995
3447,"Good Earth, The",Drama,tt0028944,7.7,4046,0,138,PASSED,"Drama, Romance","Sidney Franklin, Victor Fleming, Gustav Machaty, Sam Wood","Paul Muni, Luise Rainer, Walter Connolly, Tilly Losch",1937
3448,"Good Morning, Vietnam","Comedy, Drama, War",tt0093105,7.3,114889,67,121,R,"Biography, Comedy, Drama, War",Barry Levinson,"Robin Williams, Forest Whitaker, Tung Thanh Tran, Chintara Sukapatana",1987
3449,"Good Mother, The",Drama,tt0095238,5.9,1409,0,103,R,"Drama, Romance",Leonard Nimoy,"Diane Keaton, Liam Neeson, Jason Robards, Ralph Bellamy",1988
3450,Grumpy Old Men,Comedy,tt0107050,7.0,39506,53,103,PG-13,"Comedy, Drama, Romance",Donald Petrie,"Jack Lemmon, Walter Matthau, AnnMargret, Burgess Meredith",1993
3451,Guess Who's Coming to Dinner,"Comedy, Drama",tt0061735,7.8,34587,63,108,Not Rated,"Comedy, Drama",Stanley Kramer,"Spencer Tracy, Sidney Poitier, Katharine Hepburn, Katharine Houghton",1967
3452,Romeo Must Die,"Action, Romance",tt0165929,6.1,62431,52,115,R,"Action, Crime, Thriller",Andrzej Bartkowiak,"Jet Li, Aaliyah, Isaiah Washington, Russell Wong",2000
3453,Here on Earth,"Drama, Romance",tt0195778,5.1,7918,25,96,PG-13,"Drama, Romance",Mark Piznarski,"Chris Klein, Leelee Sobieski, Josh Hartnett, Michael Rooker",2000
3454,Whatever It Takes,"Comedy, Romance",tt0202402,5.5,8962,20,94,PG-13,"Comedy, Drama, Romance",David Raynr,"Jodi Lyn O'Keefe, Shane West, Marla Sokoloff, Manu Intiraymi",2000
3455,Buddy Boy,"Drama, Thriller",tt0146516,6.4,940,36,105,R,"Drama, Thriller",Mark Hanlon,"Aidan Gillen, Emmanuelle Seigner, Susan Tyrrell, Mark Boone Junior",1999
3456,"Color of Paradise, The (Rang-e Khoda)",Drama,tt0191043,8.2,13817,80,90,PG,"Drama, Family",Majid Majidi,"Hossein Mahjoub, Mohsen Ramezani, Salameh Feyzi, Farahnaz Safari",1999
2005,"Goonies, The","Adventure, Children's, Fantasy",tt0089218,7.8,212360,60,114,PG,"Adventure, Comedy, Family",Richard Donner,"Sean Astin, Josh Brolin, Jeff Cohen, Corey Feldman",1985
2006,"Mask of Zorro, The","Action, Adventure, Romance",tt0120746,6.7,154499,63,136,PG-13,"Action, Adventure, Comedy, Romance, Thriller, Western",Martin Campbell,"Jose Maria de Tavira, Diego Sieres, Emiliano Guerra, Yolanda Orizaga",1998
2007,Polish Wedding,Comedy,tt0119910,5.4,2976,0,105,PG-13,"Comedy, Drama, Romance",Theresa Connelly,"Claire Danes, Jon Bradford, Lena Olin, Ramsey Krull",1998
2008,"This World, Then the Fireworks","Crime, Drama, Film-Noir",tt0117898,5.1,959,0,100,R,"Crime, Drama, Thriller",Michael Oblowitz,"Philip Loch, Elis Imboden, Christian Durango, Sloan Cobb",1996
2009,Soylent Green,"Sci-Fi, Thriller",tt0070723,7.1,51707,66,97,PG,"Crime, Mystery, Sci-Fi, Thriller",Richard Fleischer,"Charlton Heston, Leigh TaylorYoung, Chuck Connors, Joseph Cotten",1973
2010,Metropolis,Sci-Fi,tt0017136,8.3,140268,98,153,Not Rated,"Drama, Sci-Fi",Fritz Lang,"Alfred Abel, Gustav Frohlich, Rudolf KleinRogge, Fritz Rasp",1926
2011,Back to the Future Part II,"Comedy, Sci-Fi",tt0096874,7.8,415923,57,108,PG,"Adventure, Comedy, Sci-Fi",Robert Zemeckis,"Michael J Fox, Christopher Lloyd, Lea Thompson, Thomas F Wilson",1989
2012,Back to the Future Part III,"Comedy, Sci-Fi, Western",tt0099088,7.4,349529,55,118,PG,"Adventure, Comedy, Sci-Fi, Western",Robert Zemeckis,"Michael J Fox, Christopher Lloyd, Mary Steenburgen, Thomas F Wilson",1990
2013,"Poseidon Adventure, The","Action, Adventure",tt0069113,7.1,37166,70,117,PG,"Action, Adventure, Drama, Thriller",Ronald Neame,"Gene Hackman, Ernest Borgnine, Red Buttons, Carol Lynley",1972
2014,Freaky Friday,"Children's, Comedy",tt0076054,6.3,10498,51,95,G,"Comedy, Family, Fantasy",Gary Nelson,"Barbara Harris, Jodie Foster, John Astin, Patsy Kelly",1977
2015,"Absent Minded Professor, The","Children's, Comedy, Fantasy",tt0054594,6.8,6350,0,92,APPROVED,"Comedy, Family, Sci-Fi, Sport",Robert Stevenson,"Fred MacMurray, Nancy Olson, Keenan Wynn, Tommy Kirk",1961
2016,"Apple Dumpling Gang Rides Again, The","Children's, Comedy, Western",tt0078790,6.0,2036,0,88,G,"Comedy, Family, Western",Vincent McEveety,"Tim Conway, Don Knotts, Tim Matheson, Kenneth Mars",1979
2017,Babes in Toyland,"Children's, Fantasy, Musical",tt0054649,6.3,2977,0,106,Approved,"Comedy, Family, Fantasy, Musical, Romance",Jack Donohue,"Ray Bolger, Tommy Sands, Annette Funicello, Ed Wynn",1961
2018,Bambi,"Animation, Children's",tt0034492,7.3,115222,91,70,G,"Animation, Drama, Family","James Algar, Samuel Armstrong, David Hand, Graham Heid, Bill Roberts, Paul Satterfield, Norman Wright","Hardie Albright, Stan Alexander, Bobette Audrey, Peter Behn",1942
2019,Seven Samurai (The Magnificent Seven) (Shichinin no samurai),"Action, Drama",tt0047478,8.7,277323,98,207,Not Rated,"Adventure, Drama",Akira Kurosawa,"Toshiro Mifune, Takashi Shimura, Keiko Tsushima, Yukiko Shimazaki",1954
2020,Dangerous Liaisons,"Drama, Romance",tt0094947,7.6,58896,74,119,R,"Drama, Romance",Stephen Frears,"Glenn Close, John Malkovich, Michelle Pfeiffer, Swoosie Kurtz",1988
2021,Dune,"Fantasy, Sci-Fi",tt0087182,6.6,109278,40,137,PG-13,"Action, Adventure, Sci-Fi",David Lynch,"Francesca Annis, Leonardo Cimino, Brad Dourif, Jose Ferrer",1984
2022,"Last Temptation of Christ, The",Drama,tt0095497,7.6,45702,80,164,R,Drama,Martin Scorsese,"Willem Dafoe, Harvey Keitel, Paul Greco, Steve Shill",1988
2023,"Godfather: Part III, The","Action, Crime, Drama",tt0099674,7.6,321410,60,162,R,"Crime, Drama",Francis Ford Coppola,"Al Pacino, Diane Keaton, Talia Shire, Andy Garcia",1990
2024,"Rapture, The","Drama, Mystery",tt0102757,6.4,4513,0,100,R,"Drama, Mystery",Michael Tolkin,"Mimi Rogers, Darwyn Carson, Patrick Bauchau, Marvin Elkins",1991
2025,Lolita,"Drama, Romance",tt0119558,6.9,45901,46,137,R,"Drama, Romance",Adrian Lyne,"Jeremy Irons, Melanie Griffith, Frank Langella, Dominique Swain",1997
2026,Disturbing Behavior,"Horror, Thriller",tt0134619,5.6,19191,0,84,R,"Horror, Mystery, Sci-Fi, Thriller",David Nutter,"James Marsden, Katie Holmes, Tobias Mehler, Nick Stahl",1998
2027,Mafia!,"Comedy, Crime",tt0120741,5.5,13710,0,87,PG-13,"Comedy, Crime",Jim Abrahams,"Jay Mohr, Billy Burke, Christina Applegate, Pamela Gidley",1998
2028,Saving Private Ryan,"Action, Drama, War",tt0120815,8.6,1084736,91,169,R,"Drama, War",Steven Spielberg,"Tom Hanks, Tom Sizemore, Edward Burns, Barry Pepper",1998
2029,Billy's Hollywood Screen Kiss,"Comedy, Romance",tt0137386,7.0,3467,0,92,R,"Comedy, Romance",Tommy O'Haver,"Sean Hayes, Armando ValdesKennedy, Mr Dan, Chad Boardman",1997
2030,East Palace West Palace (Dong gong xi gong),Drama,tt0119007,6.4,797,0,90,,Drama,Yuan Zhang,"Si Han, Jun Hu, Jing Ye, Wei Zhao",1997
2031,"$1,000,000 Duck","Children's, Comedy",tt0066728,5.8,1654,0,89,G,"Comedy, Family, Sci-Fi",Vincent McEveety,"Dean Jones, Sandy Duncan, Joe Flynn, Tony Roberts",1971
2032,"Barefoot Executive, The","Children's, Comedy",tt0066811,6.0,1454,0,96,G,"Family, Comedy",Robert Butler,"Kurt Russell, Joe Flynn, Harry Morgan, Wally Cox",1971
2033,"Black Cauldron, The","Animation, Children's",tt0088814,6.5,26553,59,80,PG,"Animation, Action, Adventure, Family, Fantasy, Horror","Ted Berman, Richard Rich","Grant Bardsley, Susan Sheridan, Freddie Jones, Nigel Hawthorne",1985
2034,"Black Hole, The",Sci-Fi,tt0078869,5.9,20815,0,98,PG,"Action, Sci-Fi",Gary Nelson,"Maximilian Schell, Anthony Perkins, Robert Forster, Joseph Bottoms",1979
2035,Blackbeard's Ghost,"Children's, Comedy",tt0062737,6.8,4457,0,106,Approved,"Comedy, Family, Fantasy",Robert Stevenson,"Peter Ustinov, Dean Jones, Suzanne Pleshette, Elsa Lanchester",1968
2036,Blank Check,"Children's, Comedy",tt0109287,5.2,16732,0,93,PG,"Comedy, Crime, Family",Rupert Wainwright,"Brian Bonsall, Karen Duffy, James Rebhorn, Jayne Atkinson",1994
2037,Candleshoe,"Adventure, Children's, Comedy",tt0075807,6.8,3141,0,101,G,"Adventure, Comedy, Drama, Family",Norman Tokar,"David Niven, Helen Hayes, Jodie Foster, Leo McKern",1977
2038,"Cat from Outer Space, The","Children's, Comedy, Sci-Fi",tt0077305,6.0,3746,0,104,G,"Comedy, Family, Sci-Fi",Norman Tokar,"Ken Berry, Sandy Duncan, Harry Morgan, Roddy McDowall",1978
2039,Cheetah,"Adventure, Children's",tt0097053,6.1,757,0,83,G,"Adventure, Family",Jeff Blyth,"Keith Coogan, Lucy Deakins, Colin Mothupi, Timothy Landfield",1989
2040,"Computer Wore Tennis Shoes, The","Children's, Comedy",tt0065566,6.1,3704,0,91,G,"Comedy, Family, Sci-Fi",Robert Butler,"Kurt Russell, Cesar Romero, Joe Flynn, William Schallert",1970
2041,Condorman,"Action, Adventure, Children's, Comedy",tt0082199,5.8,4149,0,90,PG,"Action, Adventure, Comedy, Drama, Family, Romance",Charles Jarrott,"Michael Crawford, Oliver Reed, Barbara Carrera, James Hampton",1981
2042,D2: The Mighty Ducks,"Children's, Comedy",tt0109520,6.0,32602,0,106,PG,"Comedy, Drama, Family, Sport",Sam Weisman,"Emilio Estevez, Kathryn Erbe, Michael Tucker, Jan Rubes",1994
2043,Darby O'Gill and the Little People,"Adventure, Children's, Fantasy",tt0052722,7.2,6054,0,93,Approved,"Adventure, Family, Fantasy, Romance",Robert Stevenson,"Albert Sharpe, Janet Munro, Sean Connery, Jimmy O'Dea",1959
2044,"Devil and Max Devlin, The",Comedy,tt0082263,5.0,1029,0,96,PG,"Comedy, Family, Fantasy",Steven Hilliard Stern,"Elliott Gould, Bill Cosby, Susan Anspach, Adam Rich",1981
2045,"Far Off Place, A","Adventure, Children's, Drama, Romance",tt0106868,6.6,3086,0,108,PG,"Adventure, Drama, Family, Romance",Mikael Salomon,"Reese Witherspoon, Ethan Embry, Jack Thompson, Sarel Bok",1993
2046,Flight of the Navigator,"Adventure, Children's, Sci-Fi",tt0091059,6.9,39583,64,90,PG,"Adventure, Family, Sci-Fi",Randal Kleiser,"Joey Cramer, Paul Reubens, Cliff De Young, Veronica Cartwright",1986
2047,"Gnome-Mobile, The",Children's,tt0061715,6.6,1725,0,84,APPROVED,"Adventure, Family, Fantasy",Robert Stevenson,"Walter Brennan, Matthew Garber, Karen Dotrice, Richard Deacon",1967
2048,"Great Mouse Detective, The","Animation, Children's",tt0091149,7.2,39619,73,74,G,"Animation, Adventure, Family, Musical, Mystery","Ron Clements, Burny Mattinson, David Michener, John Musker","Vincent Price, Barrie Ingham, Val Bettin, Susanne Pollatschek",1986
2049,"Happiest Millionaire, The","Comedy, Musical",tt0061749,6.9,1504,0,141,Approved,"Comedy, Family, Musical, Romance",Norman Tokar,"Fred MacMurray, Greer Garson, Gladys Cooper, Geraldine Page",1967
2050,Herbie Goes Bananas,"Adventure, Children's, Comedy",tt0080861,4.9,4615,55,100,G,"Adventure, Comedy, Family, Fantasy",Vincent McEveety,"Cloris Leachman, Charles Martin Smith, John Vernon, Stephen W Burns",1980
2051,Herbie Goes to Monte Carlo,"Adventure, Children's, Comedy",tt0076137,5.6,6037,38,105,G,"Action, Adventure, Comedy, Family, Romance",Vincent McEveety,"Dean Jones, Don Knotts, Julie Sommars, Jacques Marin",1977
2052,Hocus Pocus,"Children's, Comedy",tt0107120,6.8,79331,0,96,PG,"Comedy, Family, Fantasy",Kenny Ortega,"Bette Midler, Sarah Jessica Parker, Kathy Najimy, Omri Katz",1993
2053,"Honey, I Blew Up the Kid","Children's, Comedy, Sci-Fi",tt0104437,4.8,36981,0,89,PG,"Adventure, Comedy, Family, Romance, Sci-Fi",Randal Kleiser,"Rick Moranis, Marcia Strassman, Robert Oliveri, Daniel Shalikar",1992
2054,"Honey, I Shrunk the Kids","Adventure, Children's, Comedy, Fantasy, Sci-Fi",tt0097523,6.3,126601,63,93,PG,"Adventure, Comedy, Family, Sci-Fi",Joe Johnston,"Rick Moranis, Matt Frewer, Marcia Strassman, Kristine Sutherland",1989
2055,Hot Lead and Cold Feet,"Comedy, Western",tt0077698,6.1,1022,0,90,G,"Action, Comedy, Family, Western",Robert Butler,"Jim Dale, Karen Valentine, Don Knotts, Jack Elam",1978
2056,In Search of the Castaways,"Adventure, Children's",tt0056095,6.7,2454,0,98,APPROVED,"Adventure, Family, Fantasy",Robert Stevenson,"Maurice Chevalier, Hayley Mills, George Sanders, Wilfrid HydeWhite",1962
2057,"Incredible Journey, The","Adventure, Children's",tt0057180,7.1,3280,0,80,G,"Adventure, Drama, Family",Fletcher Markle,"Emile Genest, John Drainie, Tommy Tweed, Sandra Scott",1963
2058,"Negotiator, The","Action, Thriller",tt0120768,7.3,120538,62,140,R,"Action, Crime, Drama, Mystery, Thriller",F Gary Gray,"Samuel L Jackson, Kevin Spacey, David Morse, Ron Rifkin",1998
2059,"Parent Trap, The","Children's, Drama",tt0120783,6.5,106311,64,128,PG,"Adventure, Comedy, Drama, Family, Romance",Nancy Meyers,"Lindsay Lohan, Dennis Quaid, Natasha Richardson, Elaine Hendrix",1998
2060,BASEketball,Comedy,tt0131857,6.6,53178,38,103,R,"Comedy, Sport",David Zucker,"Trey Parker, Matt Stone, Dian Bachar, Yasmine Bleeth",1998
2061,Full Tilt Boogie,Documentary,tt0119165,6.5,2409,0,97,R,Documentary,Sarah Kelly,"Rick Stribling, Ken Bondy, Amy Minda Cohen, Elizabeth Avellan",1997
2062,"Governess, The","Drama, Romance",tt0120687,6.3,2683,60,115,R,"Drama, Romance",Sandra Goldbacher,"Minnie Driver, Tom Wilkinson, Florence Hoath, Jonathan Rhys Meyers",1998
2063,Seventh Heaven (Le Septime ciel),"Drama, Romance",tt0124115,6.7,346,0,88,,Drama,Benoit Jacquot,"Sandrine Kiberlain, Vincent Lindon, Francois Berleand, Francine Berge",1997
2064,Roger & Me,"Comedy, Documentary",tt0098213,7.5,24617,70,91,R,Documentary,Michael Moore,"Michael Moore, Roger B Smith, Rhonda Britton, Fred Ross",1989
2065,"Purple Rose of Cairo, The","Comedy, Drama, Romance",tt0089853,7.7,42331,75,82,PG,"Comedy, Fantasy, Romance",Woody Allen,"Mia Farrow, Jeff Daniels, Danny Aiello, Irving Metzman",1985
2066,Out of the Past,Film-Noir,tt0039689,8.0,28430,0,97,Not Rated,"Crime, Drama, Film-Noir, Romance, Thriller",Jacques Tourneur,"Robert Mitchum, Jane Greer, Kirk Douglas, Rhonda Fleming",1947
2067,Doctor Zhivago,"Drama, Romance, War",tt0059113,8.0,63184,69,197,PG-13,"Drama, Romance, War",David Lean,"Omar Sharif, Julie Christie, Geraldine Chaplin, Rod Steiger",1965
2068,Fanny and Alexander,Drama,tt0083922,8.1,51446,100,188,R,Drama,Ingmar Bergman,"Kristina Adolphson, Borje Ahlstedt, Pernilla Allwin, Kristian Almgren",1982
2069,"Trip to Bountiful, The",Drama,tt0090203,7.6,3497,0,108,PG,Drama,Peter Masterson,"Geraldine Page, John Heard, Carlin Glynn, Richard Bradford",1985
2070,Tender Mercies,Drama,tt0086423,7.4,8314,0,92,PG,"Drama, Music",Bruce Beresford,"Robert Duvall, Tess Harper, Betty Buckley, Wilford Brimley",1983
2071,And the Band Played On,Drama,tt0106273,7.8,8626,0,141,PG-13,"Drama, History",Roger Spottiswoode,"Matthew Modine, Alan Alda, Patrick Bauchau, Nathalie Baye",1993
2072,"'burbs, The",Comedy,tt0096734,6.9,60675,44,101,PG,"Comedy, Mystery, Thriller",Joe Dante,"Tom Hanks, Bruce Dern, Carrie Fisher, Rick Ducommun",1989
2073,Fandango,Comedy,tt0089126,6.7,6809,0,91,PG,"Comedy, Drama",Kevin Reynolds,"Kevin Costner, Judd Nelson, Sam Robards, Chuck Bush",1985
2074,"Night Porter, The (Il Portiere di notte)",Drama,tt0071910,6.8,9524,0,118,R,Drama,Liliana Cavani,"Dirk Bogarde, Charlotte Rampling, Philippe Leroy, Gabriele Ferzetti",1974
2075,Mephisto,"Drama, War",tt0082736,7.9,8170,0,144,UNRATED,Drama,Istvan Szabo,"Klaus Maria Brandauer, Krystyna Janda, Ildiko Bansagi, Rolf Hoppe",1981
2076,Blue Velvet,"Drama, Mystery",tt0090756,7.8,159958,76,120,R,"Drama, Mystery, Thriller",David Lynch,"Isabella Rossellini, Kyle MacLachlan, Dennis Hopper, Laura Dern",1986
2077,"Journey of Natty Gann, The","Adventure, Children's",tt0089385,7.0,4544,0,101,PG,"Family, Adventure",Jeremy Kagan,"Meredith Salenger, John Cusack, Ray Wise, Lainie Kazan",1985
2078,"Jungle Book, The","Animation, Children's, Comedy, Musical",tt0061852,7.6,148168,65,78,G,"Animation, Adventure, Family, Musical",Wolfgang Reitherman,"Phil Harris, Sebastian Cabot, Bruce Reitherman, George Sanders",1967
2079,Kidnapped,"Children's, Drama",tt0053994,6.7,1130,0,97,Approved,"Action, Adventure, Drama, Family",Robert Stevenson,"Peter Finch, James MacArthur, Bernard Lee, John Laurie",1960
2080,Lady and the Tramp,"Animation, Children's, Comedy, Musical, Romance",tt0048280,7.3,105927,78,76,G,"Animation, Adventure, Comedy, Drama, Family, Romance","Clyde Geronimi, Wilfred Jackson, Hamilton Luske","Peggy Lee, Larry Roberts, Bill Baucom, Verna Felton",1955
2081,"Little Mermaid, The","Animation, Children's, Comedy, Musical, Romance",tt0097757,7.6,207460,88,83,G,"Animation, Family, Fantasy, Musical, Romance","Ron Clements, John Musker","Rene Auberjonois, Christopher Daniel Barnes, Jodi Benson, Pat Carroll",1989
2082,"Mighty Ducks, The","Children's, Comedy",tt0104868,6.5,51786,46,100,PG,"Comedy, Drama, Family, Sport",Stephen Herek,"Emilio Estevez, Joss Ackland, Lane Smith, Heidi Kling",1992
2083,"Muppet Christmas Carol, The","Children's, Musical",tt0104940,7.7,42362,64,85,G,"Comedy, Drama, Family, Fantasy, Musical",Brian Henson,"Michael Caine, Dave Goelz, Steve Whitmire, Jerry Nelson",1992
2084,Newsies,"Children's, Musical",tt0104990,7.0,17154,46,121,PG,"Drama, Family, History, Musical",Kenny Ortega,"Christian Bale, David Moscow, Luke Edwards, Max Casella",1992
2085,101 Dalmatians,"Animation, Children's",tt0055254,7.2,134482,83,79,G,"Animation, Adventure, Comedy, Family","Clyde Geronimi, Hamilton Luske, Wolfgang Reitherman","Rod Taylor, J Pat O'Malley, Betty Lou Gerson, Martha Wentworth",1961
2086,One Magic Christmas,"Drama, Fantasy",tt0089731,6.6,2696,0,89,G,"Family, Fantasy",Phillip Borsos,"Mary Steenburgen, Gary Basaraba, Harry Dean Stanton, Arthur Hill",1985
2087,Peter Pan,"Animation, Children's, Fantasy, Musical",tt0046183,7.3,109394,76,77,G,"Animation, Adventure, Family, Fantasy, Musical","Clyde Geronimi, Wilfred Jackson, Hamilton Luske, Jack Kinney","Bobby Driscoll, Kathryn Beaumont, Hans Conried, Bill Thompson",1953
2088,Popeye,"Adventure, Comedy, Musical",tt0081353,5.2,26509,64,114,PG,"Adventure, Comedy, Family, Fantasy, Musical, Romance",Robert Altman,"Robin Williams, Shelley Duvall, Ray Walston, Paul Dooley",1980
2089,"Rescuers Down Under, The","Animation, Children's",tt0100477,6.9,33153,70,77,G,"Animation, Adventure, Crime, Drama, Family, Fantasy, Mystery","Hendel Butoy, Mike Gabriel","Bob Newhart, Eva Gabor, John Candy, Tristan Rogers",1990
2090,"Rescuers, The","Animation, Children's",tt0076618,6.9,51071,74,78,G,"Animation, Adventure, Comedy, Family, Fantasy","John Lounsbery, Wolfgang Reitherman, Art Stevens","Bob Newhart, Eva Gabor, Geraldine Page, Joe Flynn",1977
2091,Return from Witch Mountain,"Children's, Sci-Fi",tt0078158,5.9,3895,0,95,G,"Family, Adventure, Sci-Fi, Fantasy",John Hough,"Bette Davis, Christopher Lee, Kim Richards, Ike Eisenmann",1978
2092,"Return of Jafar, The","Animation, Children's, Musical",tt0107952,5.9,23012,0,69,G,"Animation, Adventure, Comedy, Family, Fantasy, Musical, Romance","Toby Shelton, Tad Stones, Alan Zaslove","Jason Alexander, Jonathan Freeman, Jeff Bennett, Gilbert Gottfried",1993
2093,Return to Oz,"Adventure, Children's, Fantasy, Sci-Fi",tt0089908,6.8,22056,42,113,PG,"Adventure, Family, Fantasy, Horror, Mystery",Walter Murch,"Fairuza Balk, Nicol Williamson, Jean Marsh, Piper Laurie",1985
2094,"Rocketeer, The","Action, Adventure, Sci-Fi",tt0102803,6.4,47982,61,108,PG,"Action, Adventure, Family, Sci-Fi",Joe Johnston,"Billy Campbell, Jennifer Connelly, Alan Arkin, Timothy Dalton",1991
2095,"Shaggy D.A., The","Children's, Comedy",tt0075200,5.9,2212,0,91,G,"Comedy, Family, Fantasy",Robert Stevenson,"Dean Jones, Tim Conway, Suzanne Pleshette, Keenan Wynn",1976
2096,Sleeping Beauty,"Animation, Children's, Musical",tt0053285,7.3,120301,85,75,G,"Animation, Family, Fantasy, Musical, Romance",Clyde Geronimi,"Mary Costa, Bill Shirley, Eleanor Audley, Verna Felton",1959
2097,Something Wicked This Way Comes,"Children's, Horror",tt0086336,6.8,7486,0,95,PG,"Fantasy, Mystery, Thriller",Jack Clayton,"Jason Robards, Jonathan Pryce, Diane Ladd, Royal Dano",1983
2098,Son of Flubber,"Children's, Comedy",tt0057518,6.1,2355,0,100,Approved,"Comedy, Sci-Fi, Family",Robert Stevenson,"Fred MacMurray, Nancy Olson, Keenan Wynn, Tommy Kirk",1963
2099,Song of the South,"Adventure, Animation, Children's, Musical",tt0038969,7.3,9849,54,94,APPROVED,"Animation, Comedy, Family, Fantasy, Musical","Wilfred Jackson, Harve Foster","Ruth Warrick, Bobby Driscoll, James Baskett, Luana Patten",1946
2100,Splash,"Comedy, Fantasy, Romance",tt0088161,6.2,62277,71,111,PG,"Comedy, Fantasy, Romance",Ron Howard,"Tom Hanks, Daryl Hannah, Eugene Levy, John Candy",1984
2101,Squanto: A Warrior's Tale,"Adventure, Drama",tt0111271,6.1,992,0,102,PG,"Adventure, Biography, Drama, Family",Xavier Koller,"Adam Beach, Sheldon Peters Wolfchild, Irene Bedard, Eric Schweig",1994
2102,Steamboat Willie,"Animation, Children's, Comedy, Musical",tt0019422,7.7,5817,0,8,,"Animation, Short, Comedy, Family, Musical","Ub Iwerks, Walt Disney",Walt Disney,1940
2103,Tall Tale,"Adventure, Children's",tt0111359,5.9,2951,0,96,PG,"Adventure, Family, Fantasy, Western",Jeremiah S Chechik,"Patrick Swayze, Oliver Platt, Roger Aaron Brown, Nick Stahl",1994
2104,Tex,Drama,tt0084783,6.6,1724,78,103,PG,Drama,Tim Hunter,"Matt Dillon, Jim Metzler, Meg Tilly, Bill McKinney",1982
2105,Tron,"Action, Adventure, Fantasy, Sci-Fi",tt0084827,6.8,104868,58,96,PG,"Action, Adventure, Sci-Fi",Steven Lisberger,"Jeff Bridges, Bruce Boxleitner, David Warner, Cindy Morgan",1982
2106,Swing Kids,"Drama, War",tt0108265,6.8,14560,39,112,PG-13,"Drama, Music",Thomas Carter,"Robert Sean Leonard, Christian Bale, Frank Whaley, Barbara Hershey",1993
2107,Halloween: H20,"Horror, Thriller",tt0120694,5.7,59626,52,86,R,"Horror, Thriller",Steve Miner,"Jamie Lee Curtis, Adam Arkin, Michelle Williams, Adam HannByrd",1998
2108,L.A. Story,"Comedy, Romance",tt0102250,6.7,27575,66,95,PG-13,"Comedy, Drama, Fantasy, Romance",Mick Jackson,"Steve Martin, Victoria Tennant, Richard E Grant, Marilu Henner",1991
