itemId,title,genres,imdb_id,imdb_rating,imdb_votes,metascore,runtime,MPAA_rating,imdb_genres,director,actors,year
595,Beauty and the Beast,"Animation, Children's, Musical",tt0101414,8.0,381062,95,84,G,"Animation, Family, Fantasy, Musical, Romance","Gary Trousdale, Kirk Wise","Robby Benson, Jesse Corti, Rex Everhart, Angela Lansbury",1991
596,Pinocchio,"Animation, Children's",tt0032910,7.5,112744,99,88,G,"Animation, Comedy, Family, Fantasy, Musical","Norman Ferguson, T Hee, Wilfred Jackson, Jack Kinney, Hamilton Luske, Bill Roberts, Ben Sharpsteen","Jack Bailey, Mel Blanc, Billy Bletcher, Don Brodie",1940
597,Pretty Woman,"Comedy, Romance",tt0100405,7.0,255191,51,119,R,"Comedy, Romance",Garry Marshall,"Richard Gere, Julia Roberts, Ralph Bellamy, Jason Alexander",1990
598,Window to Paris,Comedy,tt0110719,7.4,1142,0,87,PG-13,"Comedy, Drama, Fantasy",Yuri Mamin,"Agnes Soral, Sergey Dreyden, Viktor Mikhaylov, Nina Usatova",1994
599,"Wild Bunch, The",Western,tt0065214,8.0,70877,95,135,R,"Action, Adventure, Western",Sam Peckinpah,"William Holden, Ernest Borgnine, Robert Ryan, Edmond O'Brien",1969
600,Love and a .45,Thriller,tt0110395,6.1,3588,0,101,R,"Crime, Romance, Thriller",CM Talkington,"Gil Bellows, Renee Zellweger, Rory Cochrane, Jeffrey Combs",1994
601,"Wooden Man's Bride, The (Wu Kui)",Drama,tt0111752,6.9,205,0,113,,Drama,Jianxin Huang,"Shih Chang, Lan Wang, Yumei Wang, Mingjun Kao",1994
602,"Great Day in Harlem, A",Documentary,tt0109934,7.6,362,0,60,NOT RATED,"Documentary, Music",Jean Bach,"Quincy Jones, Dizzy Gillespie, Sonny Rollins, Buck Clayton",1994
603,"Bye Bye, Love",Comedy,tt0112606,6.1,4408,0,106,PG-13,Comedy,Sam Weisman,"Matthew Modine, Randy Quaid, Paul Reiser, Janeane Garofalo",1995
604,Criminals,Documentary,tt0211134,5.0,91,0,0,,"Crime, Reality-TV",nan,"Alex Mebane, Tom Sparks, Camille King, Tommy Barnes",1996
605,One Fine Day,"Drama, Romance",tt0117247,6.5,40007,0,108,PG,"Comedy, Drama, Romance",Michael Hoffman,"Michelle Pfeiffer, George Clooney, Mae Whitman, Alex D Linz",1996
606,Candyman: Farewell to the Flesh,Horror,tt0112625,5.3,8823,0,93,R,Horror,Bill Condon,"Tony Todd, Kelly Rowan, William O'Leary, Bill Nunn",1995
607,Century,Drama,tt0106537,6.3,258,0,112,R,"Drama, Romance",Stephen Poliakoff,"Charles Dance, Clive Owen, Miranda Richardson, Robert Stephens",1993
608,Fargo,"Crime, Drama, Thriller",tt0116282,8.1,550751,85,98,R,"Crime, Drama, Thriller","Joel Coen, Ethan Coen","William H Macy, Steve Buscemi, Peter Stormare, Kristin Rudrud",1996
609,Homeward Bound II: Lost in San Francisco,"Adventure, Children's",tt0116552,5.9,12404,0,88,G,"Adventure, Comedy, Family, Romance",David R Ellis,"Michael J Fox, Sally Field, Ralph Waite, Al Michaels",1996
610,Heavy Metal,"Action, Adventure, Animation, Horror, Sci-Fi",tt0082509,6.7,27723,51,86,R,"Animation, Adventure, Fantasy, Sci-Fi","Gerald Potterton, John Bruno, John Halas, Julian Harris, Jimmy T Murakami, Barrie Nelson, Paul Sabella, Jack Stokes, Pino Van Lamsweerde, Harold Whitaker","Don Francks, Caroline Semple, Richard Romanus, Susan Roman",1981
611,Hellraiser: Bloodline,"Action, Horror, Sci-Fi",tt0116514,5.1,17235,21,85,R,"Horror, Sci-Fi",Kevin Yagher,"Bruce Ramsay, Valentina Vargas, Doug Bradley, Charlotte Chatton",1996
612,"Pallbearer, The",Comedy,tt0117283,4.9,7272,0,98,PG-13,"Comedy, Romance",Matt Reeves,"David Schwimmer, Gwyneth Paltrow, Michael Rapaport, Toni Collette",1996
613,Jane Eyre,"Drama, Romance",tt0116684,6.8,8377,0,112,PG,"Drama, Romance",Franco Zeffirelli,"Anna Paquin, Nic Knight, Nicola Howard, Sasha Graff",1996
614,Loaded,"Drama, Thriller",tt0284557,0.0,0,0,0,X,Adult,nan,"Ryan Block, Bryse Denim, Brett Ford, Keller Hyde",1994
615,Bread and Chocolate (Pane e cioccolata),Drama,tt0070506,7.6,1304,0,100,,"Comedy, Drama",Franco Brusati,"Nino Manfredi, Paolo Turco, Ugo D'Alessio, Tano Cimarosa",1973
616,"Aristocats, The","Animation, Children's",tt0065421,7.1,80663,66,78,G,"Animation, Adventure, Comedy, Family, Musical",Wolfgang Reitherman,"Phil Harris, Eva Gabor, Sterling Holloway, Scatman Crothers",1970
617,"Flower of My Secret, The (La Flor de Mi Secreto)",Drama,tt0113083,7.1,8973,75,103,R,Drama,Pedro Almodovar,"Marisa Paredes, Juan Echanove, Carme Elias, Rossy de Palma",1995
618,Two Much,"Comedy, Romance",tt0118001,5.4,4898,0,118,PG-13,"Comedy, Romance",Fernando Trueba,"Antonio Banderas, Melanie Griffith, Daryl Hannah, Danny Aiello",1996
619,Ed,Comedy,tt0116165,2.6,7809,25,94,PG,"Comedy, Family, Sport",Bill Couturie,"Matt LeBlanc, Gene Ross, Paul Hewitt, Sage Allen",1996
620,Scream of Stone (Schrei aus Stein),Drama,tt0102855,6.3,1034,0,105,,Drama,Werner Herzog,"Vittorio Mezzogiorno, Stefan Glowacz, Mathilda May, Al Waxman",1991
621,My Favorite Season,Drama,tt0107471,7.3,1637,0,127,NOT RATED,"Drama, Romance",Andre Techine,"Catherine Deneuve, Daniel Auteuil, Marthe Villalonga, JeanPierre Bouvier",1993
623,"Modern Affair, A",Romance,tt0113839,5.8,155,0,90,R,"Comedy, Drama, Romance",Vern Oakley,"Lisa Eichhorn, Stanley Tucci, Caroline Aaron, Mary Jo Salerno",1995
624,Condition Red,"Action, Drama, Thriller",tt0112712,5.0,303,0,83,R,"Action, Drama, Thriller",Mika Kaurismaki,"James Russo, Cynda Williams, Paul Calderon, Victor Argo",1995
625,Asfour Stah,Drama,tt0090665,6.8,1064,0,98,UNRATED,"Drama, Comedy",Ferid Boughedir,"Selim Boughedir, Mustapha Adouani, Rabia Ben Abdallah, Mohammed Driss",1990
626,"Thin Line Between Love and Hate, A",Comedy,tt0117891,5.7,3788,0,108,R,"Comedy, Crime, Drama, Romance, Thriller",Martin Lawrence,"Martin Lawrence, Lynn Whitfield, Regina King, Bobby Brown",1996
627,"Last Supper, The","Drama, Thriller",tt0113613,6.8,13383,0,92,R,"Comedy, Crime, Drama, Thriller",Stacy Title,"Cameron Diaz, Ron Eldard, Annabeth Gish, Jonathan Penner",1995
628,Primal Fear,"Drama, Thriller",tt0117381,7.7,159752,47,129,R,"Crime, Drama, Mystery, Thriller",Gregory Hoblit,"Richard Gere, Laura Linney, John Mahoney, Alfre Woodard",1996
629,Rude,Drama,tt0114305,6.0,190,0,89,R,"Crime, Drama",Clement Virgo,"Maurice Dean Wint, Rachael Crawford, Clark Johnson, Richard Chevolleau",1995
630,Carried Away,"Drama, Romance",tt0115837,6.4,1354,0,109,R,"Drama, Romance",Bruno Barreto,"Dennis Hopper, Amy Irving, Amy Locane, Julie Harris",1996
631,All Dogs Go to Heaven 2,"Animation, Children's, Musical",tt0115509,5.5,4838,0,82,G,"Animation, Adventure, Family, Fantasy, Romance","Larry Leker, Paul Sabella","Bebe Neuwirth, Ernest Borgnine, Charlie Sheen, Hamilton Camp",1996
632,Land and Freedom (Tierra y libertad),War,tt0114671,7.6,9022,0,109,NOT RATED,"Drama, War",Ken Loach,"Ian Hart, Rosana Pastor, Iciar Bollain, Tom Gilroy",1995
633,Denise Calls Up,Comedy,tt0112844,6.8,1109,0,80,PG-13,Comedy,Hal Salwen,"Tim Daly, Caroleen Feeney, Dan Gunther, Dana WheelerNicholson",1995
634,Theodore Rex,Comedy,tt0114658,2.4,3517,0,92,PG,"Action, Comedy, Family",Jonathan R Betuel,"Whoopi Goldberg, Armin MuellerStahl, Juliet Landau, Bud Cort",1995
635,"Family Thing, A","Comedy, Drama",tt0116275,7.0,2879,71,109,PG-13,"Comedy, Drama",Richard Pearce,"Robert Duvall, James Earl Jones, Michael Beach, Irma P Hall",1996
636,Frisk,Drama,tt0113122,4.9,584,0,88,UNRATED,"Drama, Thriller",Todd Verow,"Michael Gunther, Craig Chester, Michael Stock, Raoul O'Connell",1995
637,Sgt. Bilko,Comedy,tt0117608,5.7,19517,47,93,PG,Comedy,Jonathan Lynn,"Steve Martin, Dan Aykroyd, Phil Hartman, Glenne Headly",1996
638,Jack and Sarah,Romance,tt0113448,6.6,4646,0,110,PG,"Comedy, Drama, Romance",Tim Sullivan,"Richard E Grant, Samantha Mathis, Judi Dench, Eileen Atkins",1995
639,Girl 6,Comedy,tt0116414,5.1,5334,44,108,R,"Comedy, Drama",Spike Lee,"Theresa Randle, Isaiah Washington, Spike Lee, Jenifer Lewis",1996
640,Diabolique,"Drama, Thriller",tt0116095,5.4,12281,0,107,R,"Drama, Horror, Mystery, Thriller",Jeremiah S Chechik,"Sharon Stone, Isabelle Adjani, Chazz Palminteri, Kathy Bates",1996
641,"Little Indian, Big City (Un indien dans la ville)",Comedy,tt0111543,5.6,3704,0,90,PG,"Adventure, Comedy, Romance",Herve Palud,"Thierry Lhermitte, Patrick Timsit, Ludwig Briand, MiouMiou",1994
642,Roula,Drama,tt0117517,6.2,131,0,97,,Drama,Martin Enlen,"Anica Dobra, Felicitas GrimmLuck, Martin Umbach, Ernst Jacobi",1995
643,Peanuts - Die Bank zahlt alles,Comedy,tt0117312,6.0,88,0,95,,Comedy,Carlo Rola,"Ulrich Muhe, Iris Berben, Marita Marschall, Rufus Beck",1996
644,Happy Weekend,Comedy,tt0116485,5.4,48,0,0,,Comedy,Ed Herzog,"Erik Goertz, Anton Rattinger, Dieter Wardetzky, Isabel Trimborn",1996
645,Nelly & Monsieur Arnaud,Drama,tt0113947,7.4,3568,0,106,,Drama,Claude Sautet,"Emmanuelle Beart, Michel Serrault, JeanHugues Anglade, Claire Nadeau",1995
647,Courage Under Fire,"Drama, War",tt0115956,6.6,46221,77,116,R,"Action, Drama, Mystery, Thriller, War",Edward Zwick,"Denzel Washington, Meg Ryan, Lou Diamond Phillips, Michael Moriarty",1996
648,Mission: Impossible,"Action, Adventure, Mystery",tt0117060,7.1,353092,59,110,PG-13,"Action, Adventure, Thriller",Brian De Palma,"Tom Cruise, Jon Voight, Emmanuelle Beart, Henry Czerny",1996
649,Cold Fever ( kldum klaka),"Comedy, Drama",tt0109028,7.1,1619,0,83,Unrated,"Comedy, Drama, Mystery",Fririk or Fririksson,"Masatoshi Nagase, Lili Taylor, Fisher Stevens, Gisli Halldorsson",1994
650,Moll Flanders,Drama,tt0117071,6.5,3732,0,123,PG-13,"Drama, Romance",Pen Densham,"Robin Wright, Morgan Freeman, Stockard Channing, John Lynch",1996
651,"Superweib, Das",Comedy,tt0117788,4.2,738,0,86,,Comedy,Sonke Wortmann,"Esther Schweins, Til Schweiger, Maren Kroymann, Richy Muller",1996
652,"301, 302",Mystery,tt0112257,6.6,902,0,100,UNRATED,"Horror, Mystery, Thriller",Cheolsu Park,"Eunjin Pang, Sinhye Hwang, ChuRyun Kim",1995
653,Dragonheart,"Action, Adventure, Fantasy",tt0116136,6.4,85474,0,103,PG-13,"Action, Adventure, Fantasy",Rob Cohen,"Dennis Quaid, David Thewlis, Pete Postlethwaite, Dina Meyer",1996
654,Und keiner weint mir nach,"Drama, Romance",tt0118026,5.4,42,0,102,,"Biography, Drama",Joseph Vilsmaier,"Peter Ketnath, Nina Hoss, Steffen Schroeder, Patrick Hinz",1996
655,Mutters Courage,Comedy,tt0117117,6.9,158,0,89,,"Drama, War",Michael Verhoeven,"George Tabori, Pauline Collins, Ulrich Tukur, Natalie Morse",1995
656,Eddie,Comedy,tt0116168,5.2,8711,0,100,PG-13,"Comedy, Sport",Steve Rash,"Whoopi Goldberg, Frank Langella, Dennis Farina, Richard Jenkins",1996
657,Yankee Zulu,"Comedy, Drama",tt0111787,6.5,1273,0,100,PG,"Comedy, Drama",Gray Hofmeyr,"Leon Schuster, John Matshikiza, Wilson Dunster, Terri Treas",1994
658,Billy's Holiday,Drama,tt0112509,4.7,138,0,92,R,Musical,Richard Wherrett,"Max Cullen, Kris McQuade, Tina Bursill, Drew Forsythe",1995
659,Purple Noon,"Crime, Thriller",tt0054189,7.8,11624,0,118,PG-13,"Crime, Drama, Thriller",Rene Clement,"Alain Delon, Marie Laforet, Maurice Ronet, Erno Crisa",1960
660,August,Drama,tt0115591,6.1,654,0,94,PG,"Comedy, Drama, Romance",Anthony Hopkins,"Anthony Hopkins, Leslie Phillips, Kate Burton, Gawn Grainger",1996
661,James and the Giant Peach,"Animation, Children's, Musical",tt0116683,6.7,55515,0,79,PG,"Animation, Adventure, Family, Fantasy, Musical",Henry Selick,"Simon Callow, Richard Dreyfuss, Jane Leeves, Joanna Lumley",1996
662,Fear,Thriller,tt0116287,6.2,36567,51,97,R,"Drama, Thriller",James Foley,"Mark Wahlberg, Reese Witherspoon, William Petersen, Amy Brenneman",1996
663,Kids in the Hall: Brain Candy,Comedy,tt0116768,6.9,7623,55,89,R,Comedy,Kelly Makin,"Dave Foley, Bruce McCulloch, Kevin McDonald, Mark McKinney",1996
664,Faithful,Comedy,tt0116269,6.0,1826,0,91,R,"Comedy, Crime, Drama",Paul Mazursky,"Cher, Chazz Palminteri, Ryan O'Neal, Paul Mazursky",1996
665,Underground,War,tt0114787,8.1,50306,0,167,Not Rated,"Comedy, Drama, War",Emir Kusturica,"Predrag 'Miki' Manojlovic, Lazar Ristovski, Mirjana Jokovic, Slavko Stimac",1995
666,All Things Fair,Drama,tt0113720,7.0,4986,0,130,Unrated,"Drama, Romance, War",Bo Widerberg,"Johan Widerberg, Marika Lagercrantz, Tomas von Bromssen, Karin Huldt",1996
667,Bloodsport 2,Action,tt0112536,4.8,2624,0,90,R,"Action, Sport",Alan Mehrez,"Daniel Bernhardt, Pat Morita, Donald Gibb, James Hong",1995
668,Pather Panchali,Drama,tt0048473,8.5,18654,0,125,Not Rated,Drama,Satyajit Ray,"Kanu Bannerjee, Karuna Bannerjee, Chunibala Devi, Uma Das Gupta",1955
669,Aparajito,Drama,tt0048956,8.2,8297,0,110,NOT RATED,Drama,Satyajit Ray,"Kamala Adhikari, Lalchand Banerjee, Kali Bannerjee, Kanu Bannerjee",1956
670,"World of Apu, The (Apur Sansar)",Drama,tt0052572,8.3,8399,0,105,NOT RATED,Drama,Satyajit Ray,"Soumitra Chatterjee, Sharmila Tagore, Alok Chakravarty, Swapan Mukherjee",1959
671,Mystery Science Theater 3000: The Movie,"Comedy, Sci-Fi",tt0117128,7.4,16813,65,73,PG-13,"Comedy, Sci-Fi",Jim Mallon,"Trace Beaulieu, Michael J Nelson, Jim Mallon, Kevin Murphy",1996
672,Tarantella,Drama,tt0114616,5.1,112,0,100,,Drama,Helen De Michiel,"Mira Sorvino, Rose Gregorio, Matthew Lillard, Frank Pellegrino",1995
673,Space Jam,"Adventure, Animation, Children's, Comedy, Fantasy",tt0117705,6.4,137817,59,88,PG,"Animation, Adventure, Comedy, Family, Fantasy, Sci-Fi, Sport",Joe Pytka,"Michael Jordan, Wayne Knight, Theresa Randle, Manner Washington",1996
674,Barbarella,"Adventure, Sci-Fi",tt0062711,5.9,28683,51,98,PG,"Adventure, Comedy, Fantasy, Sci-Fi",Roger Vadim,"Jane Fonda, John Phillip Law, Anita Pallenberg, Milo O'Shea",1968
675,Hostile Intentions,"Action, Drama, Thriller",tt0110061,4.3,196,0,90,R,"Action, Drama, Thriller",Catherine Cyran,"Tia Carrere, Rigg Kennedy, Lisa Dean Ryan, Tricia Leigh Fisher",1994
676,They Bite,Drama,tt0140614,4.9,190,0,98,,"Comedy, Horror, Sci-Fi",Brett Piper,"Donna Frotscher, Nick Baldasare, Christina Veronica, Charlie Barnett",1996
678,Some Folks Call It a Sling Blade,"Drama, Thriller",tt0108181,7.6,1549,0,25,NOT RATED,"Short, Drama, Thriller",George Hickenlooper,"Billy Bob Thornton, Molly Ringwald, JT Walsh, Jefferson Mays",1993
679,"Run of the Country, The",Drama,tt0114307,6.2,341,0,109,R,"Drama, Romance",Peter Yates,"Albert Finney, Matt Keeslar, Victoria Smurfit, Anthony Brophy",1995
680,Alphaville,Sci-Fi,tt0058898,7.2,19924,0,99,Not Rated,"Drama, Mystery, Sci-Fi, Thriller",JeanLuc Godard,"Eddie Constantine, Anna Karina, Akim Tamiroff",1965
681,Clean Slate (Coup de Torchon),Crime,tt0082206,7.7,4130,0,128,NOT RATED,"Comedy, Crime, Drama",Bertrand Tavernier,"Philippe Noiret, Isabelle Huppert, JeanPierre Marielle, Stephane Audran",1981
682,Tigrero: A Film That Was Never Made,"Documentary, Drama",tt0111430,6.8,322,0,75,,"Documentary, Drama",Mika Kaurismaki,"Samuel Fuller, Jim Jarmusch",1994
683,"Eye of Vichy, The (Oeil de Vichy, L')",Documentary,tt0107727,7.3,296,0,110,,"Documentary, War",Claude Chabrol,"Michel Bouquet, Brian Cox, Maquisard Alfonso, General Bergeret",1993
684,Windows,Drama,tt0081759,4.7,458,0,96,R,"Drama, Thriller",Gordon Willis,"Talia Shire, Joe Cortese, Elizabeth Ashley, Kay Medford",1980
685,It's My Party,Drama,tt0113443,7.1,2486,0,110,R,Drama,Randal Kleiser,"Margaret Cho, Bruce Davison, Lee Grant, Devon Gummersall",1995
687,Country Life,"Drama, Romance",tt0109491,6.8,618,0,118,PG-13,"Drama, Romance",Michael Blakemore,"Sam Neill, Greta Scacchi, John Hargreaves, Kerry Fox",1994
688,Operation Dumbo Drop,"Action, Adventure, Comedy, War",tt0114048,5.0,7798,0,107,PG,"Action, Adventure, Comedy, Drama, Family, War",Simon Wincer,"Danny Glover, Ray Liotta, Denis Leary, Doug E Doug",1995
690,"Promise, The (Versprechen, Das)",Romance,tt0111613,6.9,523,0,115,R,"Romance, Drama",Margarethe von Trotta,"Meret Becker, Corinna Harfouch, Anian Zollner, August Zirner",1994
691,Mrs. Winterbourne,"Comedy, Romance",tt0117104,6.2,6382,35,105,PG-13,"Comedy, Drama, Romance",Richard Benjamin,"Shirley MacLaine, Ricki Lake, Brendan Fraser, Miguel Sandoval",1996
692,Solo,"Action, Sci-Fi, Thriller",tt0117688,3.9,3848,0,94,PG-13,"Action, Sci-Fi, Thriller",Norberto Barba,"Mario Van Peebles, Barry Corbin, William Sadler, Jaime Gomez",1996
693,Under the Domin Tree (Etz Hadomim Tafus),Drama,tt0109751,7.2,197,0,102,,Drama,Eli Cohen,"Gila Almagor, Juliano MerKhamis, Uri Avrahami, Yael Pearl",1994
694,"Substitute, The",Action,tt0117774,5.9,10664,0,114,R,"Action, Crime, Drama, Thriller",Robert Mandel,"Tom Berenger, Raymond Cruz, William Forsythe, Luis Guzman",1996
695,True Crime,"Mystery, Thriller",tt0114736,5.3,1945,0,94,R,"Crime, Drama, Mystery, Thriller",Pat Verducci,"Alicia Silverstone, Kevin Dillon, Bill Nunn, Michael Bowen",1995
696,Butterfly Kiss,Thriller,tt0112604,6.3,1789,61,88,Not Rated,"Comedy, Drama, Romance, Thriller",Michael Winterbottom,"Amanda Plummer, Kathy Jamieson, Saskia Reeves, Des McAleer",1995
697,Feeling Minnesota,"Drama, Romance",tt0116289,5.4,9898,30,99,R,"Comedy, Crime, Drama, Romance",Steven Baigelman,"Keanu Reeves, Cameron Diaz, Vincent D'Onofrio, Delroy Lindo",1996
698,Delta of Venus,Drama,tt0109593,4.5,1649,0,102,R,Drama,Zalman King,"Audie England, Costas Mandylor, Eric da Silva, Raven Snow",1994
699,To Cross the Rubicon,Drama,tt0103095,5.4,17,0,0,,Comedy,Barry Caillier,"Patricia Royce, Lorraine Devon Wilke, JD Souther, Wade Madsen",1991
700,Angus,Comedy,tt0112368,6.7,5939,0,90,PG-13,"Comedy, Drama",Patrick Read Johnson,"Perry Anzilotti, Kathy Bates, Robert Curtis Brown, Kevin Connolly",1995
701,Daens,Drama,tt0104046,7.6,3504,0,138,,"Biography, Drama, History",Stijn Coninx,"Jan Decleir, Gerard Desarthe, Antje de Boeck, Michael Pas",1992
702,Faces,Drama,tt0062952,7.7,8256,0,130,R,Drama,John Cassavetes,"John Marley, Gena Rowlands, Lynn Carlin, Fred Draper",1968
703,Boys,Drama,tt0115742,4.8,3132,0,86,PG-13,"Mystery, Drama, Romance",Stacy Cochran,"Winona Ryder, Lukas Haas, John C Reilly, James Le Gros",1996
704,"Quest, The","Action, Adventure",tt0117420,5.6,21834,0,95,PG-13,"Action, Adventure, Thriller",JeanClaude Van Damme,"JeanClaude Van Damme, Roger Moore, James Remar, Janet Gunn",1996
705,Cosi,Comedy,tt0115951,6.8,1608,0,100,R,"Comedy, Drama, Music",Mark Joffe,"Ben Mendelsohn, Barry Otto, Toni Collette, Rachel Griffiths",1996
706,Sunset Park,Drama,tt0117784,5.9,1405,0,99,R,"Drama, Sport",Steve Gomer,"Rhea Perlman, Fredro Starr, Carol Kane, Terrence Howard",1996
707,Mulholland Falls,"Crime, Film-Noir, Thriller",tt0117107,6.2,14605,0,107,R,"Crime, Drama, Mystery, Thriller",Lee Tamahori,"Nick Nolte, Melanie Griffith, Chazz Palminteri, Michael Madsen",1996
708,"Truth About Cats & Dogs, The","Comedy, Romance",tt0117979,6.3,23785,64,97,PG-13,"Comedy, Romance",Michael Lehmann,"Uma Thurman, Janeane Garofalo, Ben Chaplin, Jamie Foxx",1996
709,Oliver & Company,"Animation, Children's",tt0095776,6.7,38640,58,74,G,"Animation, Adventure, Comedy, Family, Musical",George Scribner,"Joey Lawrence, Billy Joel, Cheech Marin, Richard Mulligan",1988
710,Celtic Pride,Comedy,tt0115851,5.2,9054,0,91,PG-13,"Comedy, Sport",Tom DeCerchio,"Damon Wayans, Daniel Stern, Dan Aykroyd, Gail O'Grady",1996
711,Flipper,"Adventure, Children's",tt0116322,5.2,9161,43,95,PG,"Family, Adventure",Alan Shapiro,"Elijah Wood, Paul Hogan, Jonathan Banks, Robert Deacon",1996
712,Captives,Drama,tt0109374,6.4,2047,0,100,R,"Crime, Drama, Romance, Thriller",Angela Pope,"Julia Ormond, Tim Roth, Keith Allen, Siobhan Redmond",1994
713,Of Love and Shadows,Drama,tt0110712,5.2,1706,0,103,R,"Drama, Romance, Thriller, War",Betty Kaplan,"Antonio Banderas, Jennifer Connelly, Stefania Sandrelli, Diego Wallraff",1994
714,Dead Man,Western,tt0112817,7.7,82293,62,121,R,"Drama, Fantasy, Western",Jim Jarmusch,"Johnny Depp, Gary Farmer, Crispin Glover, Lance Henriksen",1995
715,"Horseman on the Roof, The (Hussard sur le toit, Le)",Drama,tt0113362,7.1,5109,0,118,R,"Adventure, Drama, Romance",JeanPaul Rappeneau,"Juliette Binoche, Olivier Martinez, Pierre Arditi, Francois Cluzet",1995
716,Switchblade Sisters,Crime,tt0073778,6.6,2936,0,91,R,"Action, Crime, Drama",Jack Hill,"Robbie Lee, Joanne Nail, Monica Gayle, Asher Brauner",1975
717,Mouth to Mouth (Boca a boca),Comedy,tt0112546,6.7,1502,0,106,R,"Comedy, Romance",Manuel Gomez Pereira,"Javier Bardem, Aitana SanchezGijon, Josep Maria Flotats, Maria Barranco",1995
718,"Visitors, The (Les Visiteurs)","Comedy, Sci-Fi",tt0108500,7.0,28912,0,107,R,"Comedy, Fantasy",JeanMarie Poire,"Christian Clavier, Jean Reno, Valerie Lemercier, MarieAnne Chazel",1993
719,Multiplicity,Comedy,tt0117108,6.0,27744,0,117,PG-13,"Comedy, Romance, Sci-Fi",Harold Ramis,"Michael Keaton, Andie MacDowell, Zack Duhame, Katie Schlossberg",1996
720,Wallace & Gromit: The Best of Aardman Animation,Animation,tt0118114,8.6,3828,0,75,,"Animation, Comedy, Family",Nick Park,nan,1996
721,Halfmoon (Paul Bowles - Halbmond),Drama,tt0114103,7.0,43,0,95,,Drama,"Frieder Schlaich, Irene von Alberti","Samir Guesmi, Khaled Ksouri, Sondos Belhassen, Paul Bowles",1995
722,"Haunted World of Edward D. Wood Jr., The",Documentary,tt0113270,7.3,399,0,89,NOT RATED,"Documentary, Biography",Brett Thompson,"Maila Nurmi, Dolores Fuller, Paul Marco, Conrad Brooks",1995
723,Two Friends,Drama,tt0092123,6.7,159,0,76,,Drama,Jane Campion,"Kris Bidenko, Emma Coles, Kris McQuade, Peter Hehir",1986
724,"Craft, The","Drama, Horror",tt0115963,6.3,66926,0,101,R,"Drama, Fantasy, Horror, Thriller",Andrew Fleming,"Robin Tunney, Fairuza Balk, Neve Campbell, Rachel True",1996
725,"Great White Hype, The",Comedy,tt0116448,5.4,7934,0,91,R,"Comedy, Sport",Reginald Hudlin,"Samuel L Jackson, Jeff Goldblum, Peter Berg, Corbin Bernsen",1996
726,Last Dance,Drama,tt0116827,5.8,3576,0,103,R,"Drama, Thriller",Bruce Beresford,"Sharon Stone, Rob Morrow, Randy Quaid, Peter Gallagher",1996
727,War Stories,Documentary,tt0114894,7.7,49,0,95,,"Documentary, Romance, War",Gaylene Preston,"Jean Andrews, Judith Fyfe, Rita Graham, Neva Clarke McKenna",1995
728,Cold Comfort Farm,Comedy,tt0112701,7.3,6110,82,105,PG,"Comedy, Romance",John Schlesinger,"Eileen Atkins, Kate Beckinsale, Sheila Burrell, Stephen Fry",1995
729,"Institute Benjamenta, or This Dream People Call Human Life",Drama,tt0113429,7.3,1556,0,105,,"Animation, Drama","Stephen Quay, Timothy Quay","Mark Rylance, Alice Krige, Gottfried John, Daniel Smith",1995
730,"Low Life, The",Drama,tt0110400,6.1,440,0,96,R,Drama,George Hickenlooper,"Rory Cochrane, Sean Astin, Kyra Sedgwick, Ron Livingston",1994
731,Heaven's Prisoners,"Mystery, Thriller",tt0116508,5.7,4597,0,132,R,"Drama, Mystery, Thriller",Phil Joanou,"Alec Baldwin, Kelly Lynch, Mary Stuart Masterson, Eric Roberts",1996
732,Original Gangstas,Crime,tt0117260,5.8,1312,0,99,R,"Action, Crime, Drama, Thriller","Larry Cohen, Fred Williamson","Fred Williamson, Jim Brown, Pam Grier, Paul Winfield",1996
733,"Rock, The","Action, Adventure, Thriller",tt0117500,7.4,288369,58,136,R,"Action, Adventure, Thriller",Michael Bay,"Sean Connery, Nicolas Cage, Ed Harris, John Spencer",1996
734,Getting Away With Murder,Comedy,tt0116405,4.5,1104,0,91,R,Comedy,Harvey Miller,"Dan Aykroyd, Lily Tomlin, Jack Lemmon, Bonnie Hunt",1996
1,Toy Story,"Animation, Children's, Comedy",tt0114709,8.3,774298,95,81,G,"Animation, Adventure, Comedy, Family, Fantasy",John Lasseter,"Tom Hanks, Tim Allen, Don Rickles, Jim Varney",1995
2,Jumanji,"Adventure, Children's, Fantasy",tt0113497,6.9,263056,39,104,PG,"Adventure, Family, Fantasy",Joe Johnston,"Robin Williams, Jonathan Hyde, Kirsten Dunst, Bradley Pierce",1995
3,Grumpier Old Men,"Comedy, Romance",tt0113228,6.6,22165,46,101,PG-13,"Comedy, Romance",Howard Deutch,"Walter Matthau, Jack Lemmon, Sophia Loren, AnnMargret",1995
4,Waiting to Exhale,"Comedy, Drama",tt0114885,5.8,8571,0,124,R,"Comedy, Drama, Romance",Forest Whitaker,"Whitney Houston, Angela Bassett, Loretta Devine, Lela Rochon",1995
5,Father of the Bride Part II,Comedy,tt0113041,6.0,30686,49,106,PG,"Comedy, Family, Romance",Charles Shyer,"Steve Martin, Diane Keaton, Martin Short, Kimberly WilliamsPaisley",1995
6,Heat,"Action, Crime, Thriller",tt0113277,8.2,515783,76,170,R,"Crime, Drama, Thriller",Michael Mann,"Al Pacino, Robert De Niro, Val Kilmer, Jon Voight",1995
7,Sabrina,"Comedy, Romance",tt0114319,6.3,33162,56,127,PG,"Comedy, Drama",Sydney Pollack,"Harrison Ford, Julia Ormond, Greg Kinnear, Nancy Marchand",1995
8,Tom and Huck,"Adventure, Children's",tt0112302,5.6,8870,0,97,PG,"Adventure, Comedy, Drama, Family, Romance, Western",Peter Hewitt,"Jonathan Taylor Thomas, Brad Renfro, Eric Schweig, Charles Rocket",1995
9,Sudden Death,Action,tt0114576,5.7,29513,0,111,R,"Action, Crime, Thriller",Peter Hyams,"JeanClaude Van Damme, Powers Boothe, Raymond J Barry, Whittni Wright",1995
10,GoldenEye,"Action, Adventure, Thriller",tt0113189,7.2,220071,65,130,PG-13,"Action, Adventure, Thriller",Martin Campbell,"Pierce Brosnan, Sean Bean, Izabella Scorupco, Famke Janssen",1995
11,"American President, The","Comedy, Drama, Romance",tt0112346,6.8,47650,67,114,PG-13,"Comedy, Drama, Romance",Rob Reiner,"Michael Douglas, Annette Bening, Martin Sheen, Michael J Fox",1995
12,Dracula: Dead and Loving It,"Comedy, Horror",tt0112896,5.8,35119,0,88,PG-13,"Comedy, Fantasy, Horror",Mel Brooks,"Leslie Nielsen, Peter MacNicol, Steven Weber, Amy Yasbeck",1995
13,Balto,"Animation, Children's",tt0112453,7.1,35717,0,78,G,"Animation, Adventure, Drama, Family, History",Simon Wells,"Kevin Bacon, Bob Hoskins, Bridget Fonda, Jim Cummings",1995
14,Nixon,Drama,tt0113987,7.1,26739,66,192,R,"Biography, Drama, History",Oliver Stone,"Anthony Hopkins, Joan Allen, Powers Boothe, Ed Harris",1995
15,Cutthroat Island,"Action, Adventure, Romance",tt0112760,5.6,23849,37,124,PG-13,"Action, Adventure, Comedy",Renny Harlin,"Geena Davis, Matthew Modine, Frank Langella, Maury Chaykin",1995
16,Casino,"Drama, Thriller",tt0112641,8.2,407282,73,178,R,"Crime, Drama",Martin Scorsese,"Robert De Niro, Sharon Stone, Joe Pesci, James Woods",1995
17,Sense and Sensibility,"Drama, Romance",tt0114388,7.7,90257,84,136,PG,"Drama, Romance",Ang Lee,"James Fleet, Tom Wilkinson, Harriet Walter, Kate Winslet",1995
18,Four Rooms,Thriller,tt0113101,6.8,89264,0,98,R,Comedy,"Allison Anders, Alexandre Rockwell, Robert Rodriguez, Quentin Tarantino","Sammi Davis, Amanda De Cadenet, Valeria Golino, Madonna",1995
