itemId,title,genres,imdb_id,imdb_rating,imdb_votes,metascore,runtime,MPAA_rating,imdb_genres,director,actors,year
3141,"Two Jakes, The",Drama,tt0100828,6.1,9762,56,137,R,"Crime, Drama, Mystery, Romance",Jack Nicholson,"Jack Nicholson, Harvey Keitel, Meg Tilly, Madeleine Stowe",1990
3142,U2: Rattle and Hum,"Documentary, Musical",tt0096328,7.5,5369,0,99,PG-13,"Documentary, Music",Phil Joanou,"Bono, The Edge, Adam Clayton, Larry Mullen Jr",1988
3143,Hell in the Pacific,"Drama, War",tt0063056,7.3,6965,0,103,G,"Adventure, War",John Boorman,"Lee Marvin, Toshiro Mifune",1968
3144,"Glass Bottom Boat, The","Comedy, Romance",tt0060463,6.5,3677,0,110,Approved,"Comedy, Romance",Frank Tashlin,"Doris Day, Rod Taylor, Arthur Godfrey, John McGiver",1966
3145,"Cradle Will Rock, The",Drama,tt0150216,6.9,8415,64,132,R,Drama,Tim Robbins,"Hank Azaria, Ruben Blades, Joan Cusack, John Cusack",1999
3146,Deuce Bigalow: Male Gigolo,Comedy,tt0205000,5.7,65925,30,88,R,"Comedy, Romance",Mike Mitchell,"Rob Schneider, William Forsythe, Eddie Griffin, Arija Bareikis",1999
3147,"Green Mile, The","Drama, Thriller",tt0120689,8.5,984654,61,189,R,"Crime, Drama, Fantasy, Mystery",Frank Darabont,"Tom Hanks, David Morse, Bonnie Hunt, Michael Clarke Duncan",1999
3148,"Cider House Rules, The",Drama,tt0124315,7.4,87291,75,126,PG-13,"Drama, Romance",Lasse Hallstrom,"Tobey Maguire, Charlize Theron, Delroy Lindo, Paul Rudd",1999
3149,Diamonds,Mystery,tt0167423,5.4,1373,33,91,PG-13,"Comedy, Mystery",John Asher,"Kirk Douglas, Dan Aykroyd, Corbin Allred, Lauren Bacall",1999
3150,"War Zone, The",Drama,tt0141974,7.4,8793,68,98,R,Drama,Tim Roth,"Kate Ashfield, Annabelle Apsion, Lara Belmont, Freddie Cunliffe",1999
3151,"Bat Whispers, The","Crime, Drama, Mystery",tt0020668,6.5,659,0,83,,"Crime, Thriller, Horror",Roland West,"Chance Ward, Richard Tucker, Wilson Benge, DeWitt Jennings",1930
3152,"Last Picture Show, The",Drama,tt0067328,8.1,37027,93,118,R,Drama,Peter Bogdanovich,"Timothy Bottoms, Jeff Bridges, Cybill Shepherd, Ben Johnson",1971
3153,"7th Voyage of Sinbad, The","Action, Adventure, Fantasy",tt0051337,7.2,10071,0,88,G,"Family, Fantasy, Action, Adventure",Nathan Juran,"Kerwin Mathews, Kathryn Grant, Richard Eyer, Torin Thatcher",1958
3154,Blood on the Sun,"Drama, War",tt0037547,6.2,1480,0,98,APPROVED,"Drama, Romance, Thriller",Frank Lloyd,"James Cagney, Sylvia Sidney, Porter Hall, John Emery",1945
3155,Anna and the King,"Drama, Romance",tt0166485,6.7,33908,56,148,PG-13,"Drama, History, Romance",Andy Tennant,"Jodie Foster, YunFat Chow, Bai Ling, Tom Felton",1999
3156,Bicentennial Man,"Comedy, Drama, Sci-Fi",tt0182789,6.9,100941,42,132,PG,"Comedy, Drama, Sci-Fi",Chris Columbus,"Robin Williams, Embeth Davidtz, Sam Neill, Oliver Platt",1999
3157,Stuart Little,"Children's, Comedy",tt0164912,5.9,112707,61,84,PG,"Adventure, Comedy, Family, Fantasy",Rob Minkoff,"Michael J Fox, Geena Davis, Hugh Laurie, Jonathan Lipnicki",1999
3158,"Emperor and the Assassin, The (Jing ke ci qin wang)",Drama,tt0162866,7.3,5600,75,162,R,"Drama, History, Romance",Kaige Chen,"Li Gong, Fengyi Zhang, Zhou Sun, Xiaohe Lu",1999
3159,Fantasia 2000,"Animation, Children's, Musical",tt0120910,7.2,31778,59,75,G,"Animation, Comedy, Family, Fantasy, Music","James Algar, Gaetan Brizzi, Paul Brizzi, Hendel Butoy, Francis Glebas, Eric Goldberg, Don Hahn, Pixote Hunt","Steve Martin, Itzhak Perlman, Quincy Jones, Bette Midler",1999
3160,Magnolia,Drama,tt0175880,8.0,266636,77,188,R,Drama,Paul Thomas Anderson,"Pat Healy, Genevieve Zweig, Mark Flanagan, Neil Flynn",1999
3161,Onegin,Drama,tt0119079,6.9,6994,59,106,R,"Drama, Romance",Martha Fiennes,"Ralph Fiennes, Liv Tyler, Toby Stephens, Lena Headey",1999
3162,Simpatico,"Comedy, Drama",tt0174204,4.5,3075,41,106,R,"Drama, Comedy, Crime",Matthew Warchus,"Nick Nolte, Jeff Bridges, Sharon Stone, Catherine Keener",1999
3163,Topsy-Turvy,Drama,tt0151568,7.4,10842,90,154,R,"Biography, Comedy, Drama, History, Music, Musical",Mike Leigh,"Allan Corduner, Dexter Fletcher, Sukie Smith, Roger Heathcott",1999
3164,"Alley Cats, The",Drama,tt0064006,5.0,165,0,83,,Drama,Radley Metzger,"Anne Arthur, Karin Field, Sabrina Koch, Charlie Hickman",1968
3165,Boiling Point,"Action, Drama",tt0106455,4.9,4907,0,92,R,"Action, Crime, Drama",James B Harris,"Wesley Snipes, Dennis Hopper, Lolita Davidovich, Viggo Mortensen",1993
3166,Brenda Starr,Adventure,tt0096978,4.7,902,0,93,PG,"Adventure, Comedy, Romance",Robert Ellis Miller,"Brooke Shields, Timothy Dalton, Tony Peck, Diana Scarwid",1989
3167,Carnal Knowledge,Drama,tt0066892,7.0,9824,0,98,R,Drama,Mike Nichols,"Jack Nicholson, AnnMargret, Art Garfunkel, Candice Bergen",1971
3168,Easy Rider,"Adventure, Drama",tt0064276,7.4,87071,86,95,R,"Adventure, Drama",Dennis Hopper,"Peter Fonda, Dennis Hopper, Antonio Mendoza, Phil Spector",1969
3169,"Falcon and the Snowman, The",Drama,tt0087231,6.8,9493,68,131,R,"Biography, Crime, Drama, Thriller",John Schlesinger,"Timothy Hutton, Sean Penn, Pat Hingle, Joyce Van Patten",1984
3170,Hi-Yo Silver,Western,tt0032590,6.8,42,0,69,APPROVED,Western,"John English, William Witney","Chief Thundercloud, Lynne Roberts, Stanley Andrews, George Cleveland",1940
3171,Room at the Top,Drama,tt0053226,7.7,4346,0,115,,"Drama, Romance",Jack Clayton,"Simone Signoret, Laurence Harvey, Heather Sears, Donald Wolfit",1959
3172,Ulysses (Ulisse),Adventure,tt0047630,6.7,2959,0,94,Not Rated,"Adventure, Fantasy, History",Mario Camerini,"Kirk Douglas, Silvana Mangano, Anthony Quinn, Rossana Podesta",1954
3173,Any Given Sunday,Drama,tt0146838,6.9,105798,52,162,R,"Drama, Sport",Oliver Stone,"Al Pacino, Cameron Diaz, Dennis Quaid, James Woods",1999
3174,Man on the Moon,"Comedy, Drama",tt0125664,7.4,115425,58,118,R,"Biography, Comedy, Drama",Milos Forman,"Jim Carrey, Gerry Becker, Greyson Erik Pendry, Brittany Colonna",1999
3175,Galaxy Quest,"Adventure, Comedy, Sci-Fi",tt0177789,7.3,136706,70,102,PG,"Adventure, Comedy, Sci-Fi",Dean Parisot,"Tim Allen, Sigourney Weaver, Alan Rickman, Tony Shalhoub",1999
3176,"Talented Mr. Ripley, The","Drama, Mystery, Thriller",tt0134119,7.4,159270,76,139,R,"Crime, Drama, Thriller",Anthony Minghella,"Matt Damon, Gwyneth Paltrow, Jude Law, Cate Blanchett",1999
3177,Next Friday,Comedy,tt0195945,6.1,33219,41,98,R,Comedy,Steve Carr,"Ice Cube, Mike Epps, Justin Pierce, John Witherspoon",1999
3178,"Hurricane, The",Drama,tt0174856,7.6,85599,74,146,R,"Biography, Drama, Sport",Norman Jewison,"Denzel Washington, Vicellous Shannon, Deborah Kara Unger, Liev Schreiber",1999
3179,Angela's Ashes,Drama,tt0145653,7.3,18876,54,145,R,Drama,Alan Parker,"Emily Watson, Robert Carlyle, Joe Breen, Ciaran Owens",1999
3180,Play it to the Bone,"Comedy, Drama",tt0196857,5.4,10991,32,124,R,"Comedy, Drama, Sport",Ron Shelton,"Antonio Banderas, Woody Harrelson, Lolita Davidovich, Marie Park",1999
3181,Titus,Drama,tt0120866,7.2,18702,57,162,R,"Drama, History, Thriller",Julie Taymor,"Osheen Jones, Dario D'Ambrosi, Anthony Hopkins, Jessica Lange",1999
3182,Mr. Death: The Rise and Fall of Fred A. Leuchter Jr.,Documentary,tt0192335,7.5,5042,78,91,PG-13,"Documentary, Biography",Errol Morris,"Fred A Leuchter Jr, Robert Jan Van Pelt, David Irving, Caroline Leuchter",1999
3183,"Third Miracle, The",Drama,tt0174268,6.6,3005,55,119,R,Drama,Agnieszka Holland,"Sofia Polanska, Pavol Simon, Ivan Lukac, Patrik Minar",1999
3184,Montana,"Action, Comedy, Crime, Drama",tt0119699,6.4,1317,0,96,R,"Action, Comedy, Crime",Jennifer Leitzes,"Kyra Sedgwick, Stanley Tucci, Robin Tunney, Robbie Coltrane",1998
3185,Snow Falling on Cedars,Drama,tt0120834,6.8,13119,44,127,PG-13,"Drama, Mystery, Romance, Thriller",Scott Hicks,"Ethan Hawke, Yuki Kudo, Reeve Carney, Anne Suzuki",1999
3186,"Girl, Interrupted",Drama,tt0172493,7.4,144144,51,127,R,"Biography, Drama",James Mangold,"Winona Ryder, Angelina Jolie, Clea DuVall, Brittany Murphy",1999
3187,Trans,Drama,tt0169333,5.8,395,0,80,,"Crime, Drama",Julian Goldberger,"Lynn Boyd, Jon Daugherty, Ryan Daugherty, Stephanie Davis",1998
3188,"Life and Times of Hank Greenberg, The",Documentary,tt0208261,7.6,725,75,90,PG,"Documentary, Biography, Sport",Aviva Kempner,"Reeve Brenner, Hank Greenberg, Walter Matthau, Alan M Dershowitz",1998
3189,My Dog Skip,Comedy,tt0156812,7.0,17916,61,95,PG,"Comedy, Drama, Family",Jay Russell,"Luke Wilson, Frankie Muniz, Kevin Bacon, Diane Lane",1999
3190,Supernova,"Adventure, Sci-Fi",tt0134983,4.8,16022,19,90,PG-13,"Horror, Sci-Fi, Thriller",Walter Hill,"James Spader, Angela Bassett, Robert Forster, Lou Diamond Phillips",2000
3191,"Quarry, The",Drama,tt0169156,6.5,155,0,112,Not Rated,"Drama, Mystery, Thriller",Marion Hansel,"John Lynch, Jonny Phillips, Oscar Petersen, Sylvia Esau",1998
3192,"Terrorist, The (Malli)",Drama,tt0169302,7.2,1803,68,95,UNRATED,Drama,Santosh Sivan,"Ayesha Dharker, K Krishna, Sonu Sisupal, Vishwas",1998
3193,Creature,Documentary,tt0198385,6.3,72,0,76,,Documentary,Parris Patton,"Filberto Ascencio, Butch Dean, Dusty Dean, Stacey Dean",1999
3194,"Way We Were, The",Drama,tt0070903,7.1,19742,0,118,PG,"Drama, Romance",Sydney Pollack,"Barbra Streisand, Robert Redford, Bradford Dillman, Lois Chiles",1973
3195,Tess of the Storm Country,Drama,tt0013662,7.3,358,0,137,UNRATED,"Drama, Romance",John S Robertson,"Mary Pickford, Lloyd Hughes, Gloria Hope, David Torrence",1922
3196,Stalag 17,"Drama, War",tt0046359,8.0,47573,0,120,Not Rated,"Comedy, Drama, War",Billy Wilder,"William Holden, Don Taylor, Otto Preminger, Robert Strauss",1953
3197,"Presidio, The",Action,tt0095897,6.0,14717,31,97,R,"Action, Crime, Mystery, Thriller",Peter Hyams,"Sean Connery, Mark Harmon, Meg Ryan, Jack Warden",1988
3198,Papillon,Drama,tt0070511,8.0,111112,58,151,R,"Biography, Crime, Drama",Franklin J Schaffner,"Steve McQueen, Dustin Hoffman, Victor Jory, Don Gordon",1973
3199,Pal Joey,"Comedy, Musical, Romance",tt0050815,6.8,4009,0,111,APPROVED,"Drama, Musical, Romance",George Sidney,"Rita Hayworth, Frank Sinatra, Kim Novak, Barbara Nichols",1957
3200,"Last Detail, The","Comedy, Drama",tt0070290,7.6,19579,89,104,R,"Comedy, Drama",Hal Ashby,"Jack Nicholson, Otis Young, Randy Quaid, Clifton James",1973
3201,Five Easy Pieces,Drama,tt0065724,7.5,29656,85,98,R,Drama,Bob Rafelson,"Jack Nicholson, Karen Black, Billy Green Bush, Fannie Flagg",1970
3202,Even Dwarfs Started Small (Auch Zwerge haben klein angefangen),Drama,tt0065436,7.1,4590,0,96,NOT RATED,"Comedy, Drama",Werner Herzog,"Helmut Doring, Paul Glauer, Gisela Hertwig, Hertel Minkner",1971
3203,Dead Calm,Thriller,tt0097162,6.8,33570,70,96,R,"Horror, Thriller",Phillip Noyce,"Nicole Kidman, Sam Neill, Billy Zane, Rod Mullinar",1989
3204,"Boys from Brazil, The",Thriller,tt0077269,7.0,23155,40,125,R,"Drama, Thriller",Franklin J Schaffner,"Gregory Peck, Laurence Olivier, James Mason, Lilli Palmer",1978
3205,Black Sunday (La Maschera Del Demonio),Horror,tt0054067,7.3,11755,0,87,Not Rated,Horror,Mario Bava,"Barbara Steele, John Richardson, Andrea Checchi, Ivo Garrani",1960
3206,Against All Odds,Romance,tt0086859,5.9,9411,42,128,R,"Action, Adventure, Crime, Drama, Romance, Thriller",Taylor Hackford,"Rachel Ward, Jeff Bridges, James Woods, Alex Karras",1984
3207,"Snows of Kilimanjaro, The",Adventure,tt0045162,6.2,4218,0,114,Approved,"Adventure, Drama, Romance, War","Henry King, Roy Ward Baker","Gregory Peck, Susan Hayward, Ava Gardner, Hildegard Knef",1952
3208,Loaded Weapon 1,"Action, Comedy",tt0107659,6.1,41352,0,84,PG-13,"Action, Comedy, Crime",Gene Quintano,"Emilio Estevez, Samuel L Jackson, Jon Lovitz, Tim Curry",1993
3209,"Loves of Carmen, The",Drama,tt0040552,6.4,656,0,99,,"Adventure, Drama, Music",Charles Vidor,"Rita Hayworth, Glenn Ford, Ron Randell, Victor Jory",1948
3210,Fast Times at Ridgemont High,Comedy,tt0083929,7.2,83504,67,90,R,"Comedy, Drama",Amy Heckerling,"Sean Penn, Jennifer Jason Leigh, Judge Reinhold, Robert Romanus",1982
3211,"Cry in the Dark, A",Drama,tt0094924,6.9,8228,0,120,PG-13,"Biography, Drama",Fred Schepisi,"Meryl Streep, Sam Neill, Dale Reeves, David Hoflin",1988
3212,Born to Win,Drama,tt0066856,5.7,1387,0,88,R,"Comedy, Crime, Drama",Ivan Passer,"George Segal, Karen Black, Paula Prentiss, Jay Fletcher",1971
3213,Batman: Mask of the Phantasm,"Animation, Children's",tt0106364,7.9,37430,0,76,PG,"Animation, Action, Adventure, Crime, Drama, Family, Mystery, Romance, Sci-Fi, Thriller","Eric Radomski, Bruce Timm, Kevin Altieri, Boyd Kirkland, Frank Paur, Dan Riba","Kevin Conroy, Dana Delany, Hart Bochner, Stacy Keach",1993
3214,American Flyers,Drama,tt0088707,6.4,5124,0,113,PG-13,"Drama, Sport",John Badham,"Kevin Costner, David Marshall Grant, Rae Dawn Chong, Alexandra Paul",1985
2489,Spanish Fly,Drama,tt0152548,4.6,145,0,91,R,"Comedy, Romance",Daphna Kastner,"Daphna Kastner, Toni Canto, Martin Donovan, Danny Huston",1998
2490,Payback,"Action, Thriller",tt0120784,7.1,123566,46,100,R,"Action, Crime, Drama, Thriller",Brian Helgeland,"Mel Gibson, Gregg Henry, Maria Bello, David Paymer",1999
2491,Simply Irresistible,"Comedy, Romance",tt0145893,5.3,12525,27,96,PG-13,"Comedy, Drama, Fantasy, Romance",Mark Tarlov,"Sarah Michelle Gellar, Sean Patrick Flanery, Patricia Clarkson, Dylan Baker",1999
2492,20 Dates,Comedy,tt0138987,5.3,1652,36,87,R,"Biography, Comedy, Romance",Myles Berkowitz,"Myles Berkowitz, Elisabeth Wagner, Richard Arlook, Tia Carrere",1998
2493,"Harmonists, The",Drama,tt0128133,7.2,2959,0,115,R,"Biography, Drama, Music",Joseph Vilsmaier,"Ben Becker, Heino Ferch, Ulrich Noethen, Heinrich Schafmeister",1997
2494,"Last Days, The",Documentary,tt0174852,7.7,1713,0,87,PG-13,"Documentary, War",James Moll,"Bill Basch, Martin Basch, Randolph Braham, Alice Lok Cahana",1998
2495,"Fantastic Planet, The (La Plante sauvage)","Animation, Sci-Fi",tt0070544,7.8,19656,0,72,PG,"Animation, Sci-Fi",Rene Laloux,"Jennifer Drake, Eric Baugin, Jean Topart, Jean Valmont",1973
2496,Blast from the Past,"Comedy, Romance",tt0124298,6.6,54890,48,112,PG-13,"Comedy, Drama, Romance, Sci-Fi",Hugh Wilson,"Brendan Fraser, Alicia Silverstone, Christopher Walken, Sissy Spacek",1999
2497,Message in a Bottle,Romance,tt0139462,6.2,33083,39,126,PG-13,"Drama, Romance",Luis Mandoki,"Kevin Costner, Robin Wright, Paul Newman, John Savage",1999
2498,My Favorite Martian,"Comedy, Sci-Fi",tt0120764,5.0,11945,33,94,PG,"Comedy, Family, Sci-Fi",Donald Petrie,"Christopher Lloyd, Jeff Daniels, Elizabeth Hurley, Daryl Hannah",1999
2499,God Said 'Ha!',Comedy,tt0119207,7.2,896,0,85,PG-13,"Comedy, Drama",Julia Sweeney,"Julia Sweeney, Quentin Tarantino",1998
2500,Jawbreaker,Comedy,tt0155776,5.5,21690,22,87,R,"Comedy, Crime, Thriller",Darren Stein,"Rose McGowan, Rebecca Gayheart, Julie Benz, Judy Greer",1999
2501,October Sky,Drama,tt0132477,7.8,74004,71,108,PG,"Biography, Drama, Family",Joe Johnston,"Jake Gyllenhaal, Chris Cooper, Laura Dern, Chris Owen",1999
2502,Office Space,"Comedy, Romance",tt0151804,7.8,223704,68,89,R,Comedy,Mike Judge,"Ron Livingston, Jennifer Aniston, David Herman, Ajay Naidu",1999
2503,"Apple, The (Sib)",Drama,tt0156901,7.3,1999,0,86,,Drama,Samira Makhmalbaf,"Massoumeh Naderi, Zahra Naderi, Ghorban Ali Naderi, Azizeh Mohamadi",1998
2504,200 Cigarettes,"Comedy, Drama",tt0137338,5.9,13864,33,101,R,"Comedy, Drama, Romance",Risa Bramon Garcia,"Ben Affleck, Casey Affleck, Jennifer Albano, Jenni Blong",1999
2505,8MM,Thriller,tt0134273,6.5,114841,19,123,R,"Mystery, Thriller",Joel Schumacher,"Nicolas Cage, Joaquin Phoenix, James Gandolfini, Peter Stormare",1999
2506,"Other Sister, The","Comedy, Drama, Romance",tt0123209,6.5,11293,28,129,PG-13,"Comedy, Drama, Romance",Garry Marshall,"Juliette Lewis, Diane Keaton, Tom Skerritt, Giovanni Ribisi",1999
2507,Breakfast of Champions,Comedy,tt0120618,4.6,7297,42,110,R,Comedy,Alan Rudolph,"Bruce Willis, Albert Finney, Nick Nolte, Barbara Hershey",1999
2508,"Breaks, The",Drama,tt0181322,6.2,1063,0,86,R,Comedy,Eric Meza,"Anthony Anderson, Isaiah Barnes, Max Becker, Paula Bel",1999
2509,Eight Days a Week,Comedy,tt0119054,6.3,2747,0,92,R,"Comedy, Romance",Michael Davis,"Joshua Schaefer, Keri Russell, RD Robb, Mark L Taylor",1997
2510,Just the Ticket,"Comedy, Romance",tt0123221,5.6,1701,0,115,R,"Comedy, Romance",Richard Wenk,"Andy Garcia, Andie MacDowell, Richard Bradford, Alice Drummond",1999
2511,"Long Goodbye, The",Crime,tt0070334,7.7,22042,0,112,R,"Comedy, Crime, Drama, Mystery, Thriller",Robert Altman,"Elliott Gould, Nina van Pallandt, Sterling Hayden, Mark Rydell",1973
2512,"Ballad of Narayama, The (Narayama Bushiko)",Drama,tt0084390,7.9,6216,0,130,Not Rated,Drama,Shohei Imamura,"Ken Ogata, Sumiko Sakamoto, Tonpei Hidari, Aki Takejo",1982
2513,Pet Sematary,Horror,tt0098084,6.6,77824,38,103,R,"Horror, Thriller",Mary Lambert,"Dale Midkiff, Fred Gwynne, Denise Crosby, Brad Greenquist",1989
2514,Pet Sematary II,Horror,tt0105128,4.8,16117,35,100,R,"Fantasy, Horror",Mary Lambert,"Edward Furlong, Anthony Edwards, Clancy Brown, Jared Rushton",1992
2515,Children of the Corn II: The Final Sacrifice,Horror,tt0106557,4.3,6870,18,92,R,"Horror, Thriller",David Price,"Terence Knox, Paul Scherrer, Ryan Bollman, Christie Clark",1993
2516,Children of the Corn III,Horror,tt0109415,4.1,6077,0,92,R,"Horror, Thriller",James DR Hickox,"Daniel Cerny, Ron Melendez, Jim Metzler, Nancy Lee Grahn",1994
2517,Christine,Horror,tt0085333,6.7,61771,57,110,R,Horror,John Carpenter,"Keith Gordon, John Stockwell, Alexandra Paul, Robert Prosky",1983
2518,Night Shift,Comedy,tt0084412,6.5,12661,62,106,R,Comedy,Ron Howard,"Henry Winkler, Michael Keaton, Shelley Long, Gina Hecht",1982
2519,House on Haunted Hill,Horror,tt0051744,6.9,19827,0,75,Not Rated,"Horror, Mystery","William Castle, Rosemary Horvath","Vincent Price, Carol Ohmart, Richard Long, Alan Marshal",1958
2520,Airport,Drama,tt0065377,6.6,15634,42,137,G,"Action, Drama, Thriller","George Seaton, Henry Hathaway","Burt Lancaster, Dean Martin, Jean Seberg, Jacqueline Bisset",1970
2521,Airport 1975,Drama,tt0071110,5.6,8475,0,107,PG,"Action, Drama, Thriller",Jack Smight,"Charlton Heston, Karen Black, George Kennedy, Efrem Zimbalist Jr",1974
2522,Airport '77,Drama,tt0075648,5.6,8443,0,114,PG,"Action, Drama, Thriller",Jerry Jameson,"Jack Lemmon, Lee Grant, Brenda Vaccaro, Joseph Cotten",1977
2523,Rollercoaster,"Drama, Thriller",tt0076636,6.2,5084,0,119,PG,"Action, Crime, Drama, Thriller",James Goldstone,"George Segal, Richard Widmark, Timothy Bottoms, Henry Fonda",1977
2524,"Towering Inferno, The","Action, Drama",tt0072308,6.9,35218,69,165,PG,"Action, Drama, Thriller",John Guillermin,"Steve McQueen, Paul Newman, William Holden, Faye Dunaway",1974
2525,Alligator,"Action, Horror, Sci-Fi",tt0080354,5.9,9217,0,91,R,"Horror, Sci-Fi, Thriller",Lewis Teague,"Robert Forster, Robin Riker, Michael V Gazzo, Dean Jagger",1980
2526,Meteor,Sci-Fi,tt0079550,5.0,6029,0,108,PG,"Action, Drama, Sci-Fi, Thriller",Ronald Neame,"Sean Connery, Natalie Wood, Karl Malden, Brian Keith",1979
2527,Westworld,"Action, Sci-Fi, Thriller, Western",tt0070909,7.0,45974,77,88,PG,"Action, Sci-Fi, Thriller, Western",Michael Crichton,"Yul Brynner, Richard Benjamin, James Brolin, Norman Bartold",1973
2528,Logan's Run,"Action, Adventure, Sci-Fi",tt0074812,6.8,46722,53,119,PG,"Action, Sci-Fi",Michael Anderson,"Michael York, Richard Jordan, Jenny Agutter, Roscoe Lee Browne",1976
2529,Planet of the Apes,"Action, Sci-Fi",tt0063442,8.0,153972,79,112,G,"Adventure, Sci-Fi",Franklin J Schaffner,"Charlton Heston, Roddy McDowall, Kim Hunter, Maurice Evans",1968
2530,Beneath the Planet of the Apes,"Action, Sci-Fi",tt0065462,6.1,38397,46,95,G,"Action, Adventure, Sci-Fi",Ted Post,"James Franciscus, Kim Hunter, Maurice Evans, Linda Harrison",1970
2531,Battle for the Planet of the Apes,"Action, Sci-Fi",tt0069768,5.5,26582,40,93,G,"Action, Sci-Fi",J Lee Thompson,"Roddy McDowall, Claude Akins, Natalie Trundy, Severn Darden",1973
2532,Conquest of the Planet of the Apes,"Action, Sci-Fi",tt0068408,6.1,27614,49,88,PG,"Action, Sci-Fi",J Lee Thompson,"Roddy McDowall, Don Murray, Ricardo Montalban, Natalie Trundy",1972
2533,Escape from the Planet of the Apes,"Action, Sci-Fi",tt0067065,6.3,28932,69,98,G,"Action, Sci-Fi",Don Taylor,"Roddy McDowall, Kim Hunter, Bradford Dillman, Natalie Trundy",1971
2534,Avalanche,Action,tt0077189,3.7,1518,0,91,PG,"Action, Drama",Corey Allen,"Rock Hudson, Mia Farrow, Robert Forster, Jeanette Nolan",1978
2535,Earthquake,Action,tt0071455,5.9,12293,56,122,PG,"Action, Drama, Thriller",Mark Robson,"Charlton Heston, Ava Gardner, George Kennedy, Lorne Greene",1974
2536,"Concorde: Airport '79, The",Drama,tt0078740,4.4,4755,0,113,PG,"Action, Drama, Thriller",David Lowell Rich,"Alain Delon, Susan Blakely, Robert Wagner, Sylvia Kristel",1979
2537,Beyond the Poseidon Adventure,Adventure,tt0078856,4.6,4249,0,114,PG,"Action, Adventure",Irwin Allen,"Michael Caine, Sally Field, Telly Savalas, Peter Boyle",1979
2538,Dancemaker,Documentary,tt0175550,7.2,110,0,98,,Documentary,Matthew Diamond,"Andrew Asnes, Rachel Berman Benz, Ross Kramberg, Thomas Patrick",1998
2539,Analyze This,Comedy,tt0122933,6.7,136429,61,103,R,"Comedy, Crime",Harold Ramis,"Robert De Niro, Billy Crystal, Lisa Kudrow, Chazz Palminteri",1999
2540,"Corruptor, The","Action, Crime, Drama, Thriller",tt0142192,6.0,16539,56,110,R,"Action, Crime, Drama, Mystery, Thriller",James Foley,"YunFat Chow, Mark Wahlberg, Ric Young, Paul BenVictor",1999
2541,Cruel Intentions,Drama,tt0139134,6.8,165870,56,97,R,"Drama, Romance",Roger Kumble,"Sarah Michelle Gellar, Ryan Phillippe, Reese Witherspoon, Selma Blair",1999
2542,"Lock, Stock & Two Smoking Barrels","Comedy, Crime, Thriller",tt0120735,8.2,485324,66,107,R,"Comedy, Crime",Guy Ritchie,"Jason Flemyng, Dexter Fletcher, Nick Moran, Jason Statham",1998
2543,Six Ways to Sunday,Comedy,tt0127288,6.4,1284,0,97,R,"Comedy, Crime, Drama",Adam Bernstein,"Norman Reedus, Debbie Harry, Adrien Brody, Paul D'Amato",1997
2544,"School of Flesh, The (L' cole de la chair)",Drama,tt0157208,6.8,1324,68,110,R,"Drama, Mystery, Romance",Benoit Jacquot,"Isabelle Huppert, Vincent Martinez, Vincent Lindon, Marthe Keller",1998
2545,Relax... It's Just Sex,Comedy,tt0159696,6.9,1450,0,110,R,Comedy,PJ Castellaneta,"Mitchell Anderson, Terrence 'TC' Carson, Seymour Cassel, Lori Petty",1998
2546,"Deep End of the Ocean, The",Drama,tt0120646,6.4,11838,45,106,PG-13,Drama,Ulu Grosbard,"Michelle Pfeiffer, Treat Williams, Whoopi Goldberg, Jonathan Jackson",1999
2547,Harvest,Drama,tt0125778,4.5,265,0,96,R,Drama,Stuart Burkin,"Arthur J Nascarella, Stephen Earnhart, Evan Handler, Wil Horneff",1998
2548,"Rage: Carrie 2, The",Horror,tt0144814,4.7,14281,42,104,R,"Horror, Sci-Fi, Thriller","Katt Shea, Robert Mandel","Emily Bergl, Jason London, Dylan Bruno, J SmithCameron",1999
2549,Wing Commander,"Action, Sci-Fi",tt0131646,4.2,15522,21,100,PG-13,"Action, Adventure, Sci-Fi",Chris Roberts,"Freddie Prinze Jr, Saffron Burrows, Matthew Lillard, Tcheky Karyo",1999
2550,"Haunting, The","Horror, Thriller",tt0057129,7.6,30891,74,112,G,Horror,Robert Wise,"Julie Harris, Claire Bloom, Richard Johnson, Russ Tamblyn",1963
2551,Dead Ringers,"Drama, Thriller",tt0094964,7.3,35335,86,116,R,"Drama, Horror, Thriller",David Cronenberg,"Jeremy Irons, Genevieve Bujold, Heidi von Palleske, Barbara Gordon",1988
2552,My Boyfriend's Back,Comedy,tt0107626,5.4,3913,0,85,PG-13,"Comedy, Fantasy, Horror, Romance",Bob Balaban,"Andrew Lowery, Traci Lind, Danny Zorn, Edward Herrmann",1993
2553,Village of the Damned,"Horror, Sci-Fi, Thriller",tt0054443,7.3,12870,0,77,NOT RATED,"Horror, Sci-Fi",Wolf Rilla,"George Sanders, Barbara Shelley, Michael Gwynn, Laurence Naismith",1960
2554,Children of the Damned,"Horror, Sci-Fi, Thriller",tt0056931,6.2,3552,0,90,Approved,"Drama, Horror, Mystery, Sci-Fi",Anton Leader,"Ian Hendry, Alan Badel, Barbara Ferris, Alfred Burke",1963
2555,Baby Geniuses,Comedy,tt0118665,2.6,22896,6,97,PG,"Comedy, Crime, Family, Sci-Fi",Bob Clark,"Kathleen Turner, Christopher Lloyd, Kim Cattrall, Peter MacNicol",1999
2556,Telling You,"Comedy, Drama, Romance",tt0120859,4.3,635,0,94,R,"Comedy, Drama, Romance",Rob DeFranco,"Peter Facinelli, Andy Berman, Rob DeFranco, Gary Wolf",1998
2557,I Stand Alone (Seul contre tous),Drama,tt0157016,7.5,17106,0,93,NOT RATED,"Crime, Drama, Thriller",Gaspar Noe,"Philippe Nahon, Blandine Lenoir, Frankie Pain, Martine Audrain",1998
2558,Forces of Nature,"Comedy, Romance",tt0141098,5.4,29977,46,105,PG-13,"Comedy, Romance",Bronwen Hughes,"Ben Affleck, Sandra Bullock, Maura Tierney, Steve Zahn",1999
2559,"King and I, The","Animation, Children's",tt0160429,4.2,3306,29,87,G,"Animation, Family, Fantasy",Richard Rich,"Miranda Richardson, Christiane Noll, Martin Vidnovic, Ian Richardson",1999
2560,Ravenous,"Drama, Horror",tt0129332,7.0,33843,46,101,R,Horror,Antonia Bird,"Guy Pearce, Robert Carlyle, David Arquette, Jeremy Davies",1999
2561,True Crime,"Crime, Thriller",tt0139668,6.6,29032,65,127,R,"Crime, Drama, Mystery, Thriller",Clint Eastwood,"Clint Eastwood, Isaiah Washington, LisaGay Hamilton, James Woods",1999
2562,Bandits,Drama,tt0118682,6.4,2799,53,110,R,"Drama, Music",Katja von Garnier,"Katja Riemann, Jasmin Tabatabai, Nicolette Krebitz, Jutta Hoffmann",1997
2563,Beauty,Drama,tt0171092,6.3,316,0,90,,Romance,Jerry London,"Janine Turner, Jamey Sheridan, Linden Ashby, Shirley Broderick",1998
2564,"Empty Mirror, The",Drama,tt0116192,6.2,308,0,118,PG-13,"Drama, History, War",Barry J Hershey,"Norman Rodway, Camilla Seberg, Peter Michael Goetz, Doug McKeon",1999
2565,"King and I, The",Musical,tt0049408,7.5,21734,72,133,G,"Biography, Drama, Musical, Romance",Walter Lang,"Deborah Kerr, Yul Brynner, Rita Moreno, Martin Benson",1956
2566,Doug's 1st Movie,"Animation, Children's",tt0187819,5.0,2631,0,77,G,"Family, Animation, Comedy",Maurice Joyce,"Thomas McHugh, Fred Newman, Chris Phillips, Constance Shulman",1999
2567,EDtv,Comedy,tt0131369,6.1,38658,48,122,PG-13,"Comedy, Drama",Ron Howard,"Geoffrey Blake, Gail Boggs, Jenna Byrne, Merrin Dungey",1999
